广州星慕文化发展机构,3.351705497400818,0
青岛锦绣前程房地产开发有限公司,3.351705497400818,0
北京泰耀文化工作室,3.351705497400818,0
创意联盟制作有限公司,3.3529789590280057,0
鲁商传媒集团（山东）文化产业有限公司,3.356696868783162,0
北京泛亚视觉文化传播有限公司,3.358813974372079,0
m发行团队,3.361978898939408,0
Half Circle ,3.3647310542223705,0
Dynamo ,3.3647310542223705,0
Phoenix Pictures ,3.3647310542223705,0
北京青青树动漫科技有限公司,3.366949395209358,0
北京思泽汇通影业发展有限公司,3.373432476301091,0
上海三元影视有限公司,3.373432476301091,0
喜洋洋电影工作坊有限公司,3.375361788727285,0
香港国艺影视制作有限公司,3.377390041416569,0
岗华影视传播有限公司,3.3777486999385533,0
深圳市百慧影业传媒股份有限公司,3.3778888057925744,0
云南大唐瓦舍文化传播有限公司,3.3813515758786723,0
上海上影电通影视文化传播有限公司,3.3813515758786723,0
中视云投文化产业投资有限公司,3.3842619929658233,0
澳洲极光影业公司,3.3842619929658233,0
麦克斯传媒有限公司,3.3842619929658233,0
22h22有限责任公司,3.3842619929658233,0
君舍文化投资（北京）有限公司,3.3842619929658233,0
重庆中盛衡顺广告公司,3.3842619929658233,0
北京响巢国际传媒股份有限公司,3.3842619929658233,0
红星坞娱乐传媒投资有限公司,3.3842619929658233,0
加拿大传媒投资有限公司,3.3842619929658233,0
加拿大塞维亚电影有限公司,3.3842619929658233,0
英国诺特瑞斯电影制作有限公司,3.3842619929658233,0
美国冰川电影有限公司,3.3842619929658233,0
Ulysses Filmproduktion ,3.3899471117180275,0
Fabrique d'Images ,3.3899471117180275,0
Skyline Entertainment ,3.3899471117180275,0
Moetion Films ,3.3899471117180275,0
石头天使影业,3.3920476638363035,0
七星娱乐集团,3.3920476638363035,0
芒果tv,3.3942590074761063,0
哔哩哔哩影业（天津）有限公司,3.3942590074761063,0
58影业,3.3942590074761063,0
优漫卡通卫视,3.3942590074761063,0
北京灵动星熠文化传媒有限公司,3.3942590074761063,0
湖南快乐阳光互动娱乐传媒有限公司,3.3942590074761063,0
58同城,3.3942590074761063,0
哔哩哔哩影业,3.3942590074761063,0
米粒影视文化传播有限公司,3.3942590074761063,0
北京广播电视台,3.4086011616500036,0
北京电视艺术中心有限公司,3.4086011616500036,0
浙江横店电影院线有限公司,3.4130464915302725,0
北京金盛信马影视文化有限公司,3.413378567126942,0
北京华谊兄弟创星娱乐科技股份有限公司,3.413378567126942,0
大河影业扬州有限公司,3.413378567126942,0
天津天马映像影业有限公司,3.413378567126942,0
海南金盛信马影视文化有限公司,3.413378567126942,0
上海乐不思蜀影视有限公司,3.413378567126942,0
幸福蓝海影视文化集团股份有限公司,3.413378567126942,0
北京同人时代文化传播有限公司,3.4303911430171654,0
联创组影业公司,3.436606259813666,0
深圳一立动画影业有限公司,3.436896985744797,0
深圳市马荣天使投资有限公司,3.436896985744797,0
湖北远东卓越影视传媒有限公司,3.4371811688512124,0
南京蝶蕴文化传媒有限公司,3.4463538424463955,0
上海华宇电影股份有限公司,3.4506647232521517,0
北京中影传奇影视文化传媒有限公司,3.4529435228999557,0
北京润锦投资有限公司,3.457570061242105,0
北野武工作室,3.457570061242105,0
北京云影博纳影视发行有限公司,3.459142093076065,0
深圳市珑艺影视有限公司,3.459142093076065,0
大连龙海科技服务有限公司,3.459142093076065,0
深圳市电影发行放映公司,3.459142093076065,0
银都机构有限公司,3.4622002740286906,0
邵氏影城有限公司,3.4622002740286906,0
广州连乐文化传播有限公司,3.4622002740286906,0
汇骏娱乐有限公司,3.4622002740286906,0
北京源石影视文化有限公司,3.4622002740286906,0
北京源石影视文化有限公,3.4622002740286906,0
DAS Films Ltd. ,3.4651864821574554,0
Relativity Media ,3.4651864821574554,0
SPD Films ,3.4651864821574554,0
Envision Entertainment ,3.4651864821574554,0
Das Films ,3.4651864821574554,0
Irish DreamTime ,3.4651864821574554,0
Knightsbridge Entertainment ,3.4651864821574554,0
龙标（北京）文化发展有限公司,3.4655062806262595,0
北京橙天拾捌经纪文化有限公司,3.4655062806262595,0
卧虎湾（北京）影视文化发展有限公司,3.4655062806262595,0
大泰影业,3.466651160295219,0
浙江奇新世纪影业有限公司,3.466651160295219,0
上海视金石动画有限公司,3.4672765243033083,0
北京诚信联盟国际影视文化有限公司,3.4742016901913932,0
湖南文远国际文化传播有限公司,1.7962967400517915,1
湖南辉宏置业有限公司,1.7962967400517915,1
求是影视中心,1.7962967400517915,1
湖南华人时代文化传播有限公司,1.7962967400517915,1
湖南大众传媒职业技术学院,1.7962967400517915,1
B影映画工作室,1.7962967400517915,1
北京九州同映数字电影院线有限公司,1.8061799739838869,1
闻影天下（深圳）文化传媒有限公司,1.8061799739838869,1
北京中影华夏影视文化传媒有限公司,1.8061799739838869,1
北京良锋骏景文化传媒有限公司,1.8115750058705933,1
北京高尔东传影视文化传播有限公司,1.8147136126959766,1
亚文邦（北京）文化传播有限公司,1.816373888752362,1
河南省亚邦文化传播有限公司,1.816373888752362,1
北京景鸿影业投资有限公司,1.8210547550468879,1
美国kfm制作有限公司,1.8210547550468879,1
广东叁加壹文化传播有限公司,1.8252313231999,1
无锡金视影视制作有限公司,1.8314858392486573,1
北京润盛嘉和文化传媒有限公司,1.8314858392486573,1
唐山润盛嘉和影视传媒有限公司,1.8314858392486573,1
北京东方紫云影视公司,1.8319337304667453,1
东宝盛世国际影视文化（北京）有限公司,1.8319337304667453,1
东尼斯国际文化有限公司,1.8319337304667453,1
浙江天鹏传媒有限公司,1.8379670183686547,1
极越电影有限责任公司,1.8379670183686547,1
北京盛合经纬文化传媒有限公司,1.8417347789747436,1
安徽电影集团（安徽电影制片厂）,1.8432327780980093,1
安徽五星东方影视投资有限公司,1.8432327780980093,1
北京国是经纬科技有限公司,1.8437931983259126,1
天津滨海新区国是经纬文化传播有限公司,1.8437931983259126,1
拉萨国是经纬文化传播有限公司,1.8437931983259126,1
成都国是经纬文化传播有限公司,1.8437931983259126,1
西藏音像出版社,1.8437931983259126,1
原子映象有限公司,1.8541845438336066,1
时光草莓电影有限公司,1.8541845438336066,1
贩卖基电影事业有限公司,1.8541845438336066,1
北京鸿水文化传媒有限公司,1.8545489358129505,1
北京鸿水影业有限公司,1.8545489358129505,1
中影数字院线（北京）有限公司,1.8545489358129505,1
大连建业嘉和影视传媒有限公司,1.8545489358129505,1
山东华富资产管理有限公司,1.8545489358129505,1
天津建业嘉和影视制作有限公司,1.8545489358129505,1
北安市盛达文化传媒有限公司,1.8549130223078554,1
北京橙润影视文化有限公司,1.8549130223078554,1
峨眉电影制片厂,1.8558824300360353,1
河南奥斯卡院线有限责任公司,1.8574531170352664,1
黄太吉,1.8595585726260535,1
春光映画（北京）文化传播有限公司,1.8595585726260535,1
中国国际电视总公司,1.8616538702139107,1
上海肯米特唐华文化传媒股份有限公司,1.8616538702139107,1
上海犹太难民纪念馆,1.8616538702139107,1
中舜影业有限公司,1.868232868422465,1
北京果然精彩文化传媒有限公司,1.868232868422465,1
湖南华翼星文化影视传媒,1.8682916880178555,1
北京华瑞留芳文化传播有限公司,1.8682916880178555,1
北京标准时间电影制作有限公司,1.8682916880178555,1
广东华之杰影视传播有限公司,1.8712809728579731,1
融资城电子商务有限公司,1.8712809728579731,1
湖南潇影第二影业有限公司,1.8723311212302507,1
湖南锦绣神州影视文化有限公司,1.8723311212302507,1
共青团中央宣传部,1.8723311212302507,1
珠海怡华通投资有限公司,1.8723311212302507,1
最高人民检察院影视中心,1.8773137433122382,1
最高人民法院影视中心,1.8773137433122382,1
北京光影四季文化传播有限公司,1.8773137433122382,1
北京繁荣顺达文化传媒有限公司,1.8773137433122382,1
星际红缘国际传媒（北京）有限公司,1.8773137433122382,1
浙江华乐盛视影视制作有限公司,1.8773137433122382,1
北京衡源路德影视文化传媒中心,1.8773137433122382,1
青岛电影发行放映有限公司,1.8860392755664421,1
青岛海洋传奇影视制作有限公司,1.8860392755664421,1
河北领头羊影视传媒有限公司,1.8873922189718466,1
河南弘星影视传媒有限公司,1.8891335559667235,1
弘星（北京）数字传媒有限公司,1.8891335559667235,1
智慧工场（北京）文化传媒有限公司,1.890365121448124,1
北京央广纵横文化传媒有限公司,1.890365121448124,1
真实传媒有限公司,1.890756251918218,1
优业组合影视传媒,1.901076715726255,1
厦门维信投资公司,1.901076715726255,1
上海三味火文化投资有限公司,1.901076715726255,1
汇映国际影视,1.901076715726255,1
昆山斐凡动画有限公司,1.9028184680822533,1
北京央华影视文化有限公司,1.9057419273916014,1
表演工作坊电影有限公司,1.9057419273916014,1
北京银河星光文化传播有限公司,1.9057419273916014,1
北京龙世文化集团有限公司,1.9057419273916014,1
表演工作坊,1.9057419273916014,1
福建神画时代数码动画有限公司,1.9160326101885692,1
北京灏鑫上元影视文化传媒有限公司,1.923606643017459,1
上海竺灿文化投资有限公司,1.923606643017459,1
陕西先行文化发展有限责任公司,1.925260509519435,1
中共神木县委县政府,1.925260509519435,1
北京银幕地带文化有限公司,1.9278321328665815,1
威秀电影亚洲公司,1.9289588408808296,1
四川凹凸文化传播有限公司,1.948608549876436,1
信达国信资本管理（北京）有限公司,1.9654839242451385,1
活力天行影业投资（北京）有限公司,1.9654839242451385,1
环球传奇影视娱乐有限公司,1.9654839242451385,1
东莞市名博影视策划有限公司,1.9654839242451385,1
昆仑映画影视文化传媒（北京）有限公司,1.974419573852286,1
福建中金在线网络股份有限公司,1.974419573852286,1
青岛凤凰世纪传媒有限公司,1.9790929006383264,1
北京龙火映画文化传播有限公司,1.9790929006383264,1
北京中元盛艺文化传媒有限公司,1.9910487764526763,1
深圳市海岸明珠文化传播有限公司,1.9910487764526763,1
上海汪子琦文化传播有限公司,1.9934362304976114,1
北京华都新雨影视文化发展有限公司,2.003805073565025,1
江阴市天普文化传播有限公司,2.003977241845537,1
武汉左右影视制作有限公司,2.0071073829740573,1
湖北省检察官协会,2.0071073829740573,1
北京自由高度传媒广告有限公司,2.0099605314705973,1
北京翼非凡文化传媒有限公司,2.0114012599247437,1
北京中高精彩文化传媒有限公司,2.0145205387579233,1
深圳市前海小蚂蚁文化传媒有限公司,2.0215613920373547,1
广州文铭广告有限公司,2.0215613920373547,1
广州立兴文化传媒有限公司,2.0215613920373547,1
广州蜂锋文化传播有限公司,2.0215613920373547,1
北京华语大业文化传媒有限公司,2.0410767197154747,1
北京普乐泛森国际文化传媒有限公司,2.0410767197154747,1
青海省电影电视家协会,2.0410767197154747,1
广州知星影视文化有限公司,2.046846203945821,1
星睿影视文化传媒（北京）有限公司,2.046846203945821,1
上海银来影业有限公司,2.0514998191327445,1
上海澳娱文化传播股份有限公司,2.0514998191327445,1
宽银幕电影工作室,2.0539615073145,1
影童国际有限公司,2.0539615073145,1
常州广播电台,2.054536452654951,1
江苏卡龙动画影视传媒股份有限公司,2.054536452654951,1
宝米数位有限公司,2.0699639378507624,1
拾万电影制作有限公司,2.071587470514976,1
上海星泓文化传播有限公司,2.0751818546186915,1
励骏会（北京）文化传媒有限公司,2.0751818546186915,1
北京星泓世纪文化发展有限公司,2.0751818546186915,1
太平洋岛国贸易与投资专员署,2.0751818546186915,1
苏州光华集团有限公司,2.0751818546186915,1
前涌金融信息服务,2.0751818546186915,1
山东省五莲县人民政府,2.0751818546186915,1
山东省五莲山旅游风景区管理委员会,2.0751818546186915,1
斐济大使馆,2.0751818546186915,1
浙江本真影视发行有限公司,2.0768951938660507,1
濠龙影视传媒（上海）有限公司,2.0782755220866007,1
上海星狐影业有限公司,2.0782755220866007,1
昆山方舟广告传媒有限公司,2.0782755220866007,1
金泉华艺（北京）影视艺术有限公司,2.0803739167013093,1
苏州金泉华文化艺术传播有限公司,2.0803739167013093,1
深圳世冠娱乐文化传播有限公司,2.0826417781571314,1
南京朱雀影视动画有限公司,2.0827135801713315,1
南京日报报业集团,2.0827135801713315,1
南京宝船厂遗址文化管理有限公司,2.0827135801713315,1
四川英明影视文化艺术有限责任公司,2.083502619830267,1
北京京奇非凡影视文化有限公司,2.083502619830267,1
台湾魔力模力国际文化传播有限公司,2.083502619830267,1
陕西中博投资集团,2.1080573737838537,1
陕西大中博文化传媒有限公司,2.1080573737838537,1
荷亭听雨（北京）文化发展有限公司,2.1080573737838537,1
三亚嘉溢影视传媒有限公司,2.1080573737838537,1
中视尚影（北京）文化传媒有限公司,2.109443547064349,1
青岛飞拉利集团有限公司,2.109443547064349,1
高龙控股有限公司,2.109443547064349,1
上海飞科电器股份有限公司,2.109443547064349,1
北京昆尚文化传媒有限责任公司,2.109443547064349,1
浙江特立宙动画影视有限公司,2.1193878736223355,1
绍兴广播电视传媒集团,2.1193878736223355,1
上海炫映影视传播有限公司,2.1273316093800214,1
无限动力实业有限公司,2.1303015973418447,1
北京盛世翔和国际影视文化传播有限公司,2.1342089929320833,1
上海艺乘文化传播有限公司,2.1392177001375856,1
上海日月星文化传播有限公司,2.1392177001375856,1
松江国际影视文化传媒有限公司,2.1392177001375856,1
正能量影业无锡有限公司,2.143327129992046,1
山东电影电视剧制作中心,2.1438575755939566,1
中共山东省委宣传部,2.1438575755939566,1
北京幸福村文化交流有限公司,2.144574207609616,1
内蒙古蓝色故乡影业公司,2.144574207609616,1
南京毅刚文化传媒有限公司,2.1539367544609345,1
南京启联科技有限公司,2.1539367544609345,1
中共南京市委宣传部,2.1539367544609345,1
江苏省文学艺术界联合会,2.1539367544609345,1
南京加一点净化保健科技有限公司,2.1539367544609345,1
江苏省广播电影电视局,2.1539367544609345,1
哈尔滨松松文化发展有限公司,2.1570939489970806,1
哈尔滨智慧动画艺术有限公司,2.1570939489970806,1
广东光和传媒有限公司,2.161338049858543,1
广州演出有限公司,2.161338049858543,1
佛山市顺德区乐看动漫设计有限公司,2.161338049858543,1
洛阳世为动漫发展有限公司,2.161338049858543,1
中国电影家协会,2.1656300623761835,1
四川传媒学院,2.1753378287920198,1
知更鸟电脑艺术有限公司,2.1753378287920198,1
善为多媒体有限公司,2.1753378287920198,1
法国同一赛手有限公司,2.1811859341282296,1
北京伯爵影视文化传媒有限公司,2.1889284837608534,1
北京中民卓彩文化传媒有限公司,2.1889284837608534,1
北京中奥影迪动画制作有限公司,2.1941534361650987,1
凯天网络有限责任公司,2.1941534361650987,1
福建西岸传媒发展有限公司,2.202079441007388,1
北京连亚方舟影视娱乐有限公司,2.202079441007388,1
云南民族电影制片厂,2.2091127037385916,1
云南中泰文化发展有限公司,2.2091127037385916,1
中国文联电影艺术中心,2.2091127037385916,1
中国文联艺术中心,2.2091127037385916,1
亿星博纳影视无锡有限公司,2.2091127037385916,1
北京伟世兄弟影视文化传媒有限公司,2.209273672784876,1
沈阳伟世兄弟文化传播有限公司,2.209273672784876,1
中国三环音像社,2.210131168184136,1
南京澜印象文化传播有限公司,2.210131168184136,1
江苏大烨影视文化投资有限公司,2.210131168184136,1
无锡广播电视集团,2.2144729505233767,1
北京丝宾丝文化传媒有限公司,2.2144729505233767,1
惠州同人同业投资管理有限公司,2.2144729505233767,1
北京紫禁城三联影视发行有限公司,2.21539960109389,1
北京尚心印象文化发展有限公司,2.21539960109389,1
成都星娱影视文化发展有限公司,2.21539960109389,1
北京奇天大地影视文化传播有限公司,2.21539960109389,1
深圳平凡文化传播有限公司,2.21539960109389,1
四川太平洋文化传播有限公司,2.21539960109389,1
学者国际多媒体股份有限公司,2.2224042910824555,1
南京仙中影视传媒有限公司,2.2224042910824555,1
见证分享（北京）文化投资有限公司,2.2224042910824555,1
金星汇影艺文化有限公司,2.2224042910824555,1
时尚芭莎,2.222482357138911,1
上海大盈影视文化传播有限公司,2.2245848537315305,1
中天集团（甘肃）,2.2245848537315305,1
恩比理（上海）投资咨询有限公司,2.2245848537315305,1
利川市龙船调影视传媒公司,2.2245848537315305,1
中共利川市委宣传部,2.2245848537315305,1
北京达智兴盛文化传媒有限公司,2.2245848537315305,1
idg中国媒体基金,2.2274496204698413,1
中金华泰投资有限公司,2.2341628193907153,1
红扁担（北京）文化传播有限公司,2.2341628193907153,1
北京星邦美纳娱乐文化传媒有限公司,2.238948898311761,1
北京首印传媒有限公司,2.238948898311761,1
北京铁皮青蛙创意文化传播有限公司,2.2443266102306354,1
北京华影文轩影视文化有限公司,2.2443266102306354,1
中国传媒大学电视制作中心,2.2443266102306354,1
北京影艺通影视文化传媒有限公司,2.248757722627297,1
e美影业,2.248757722627297,1
北京传幕影视文化有限公司,2.248757722627297,1
爱时光（北京）文化传媒有限公司,2.248757722627297,1
北京亦美互动传媒广告有限公司,2.248757722627297,1
湖北长江文化传播有限公司,2.2495163158016624,1
北京游龙影视文化传媒有限责任公司,2.2495163158016624,1
麒麟网（北京）影视文化传媒有限公司,2.253822438708073,1
麒丰（上海）影视制作有限公司,2.253822438708073,1
上海宝影广告传播有限公司,2.253822438708073,1
上海埃圣玛金属科技集团有限公司,2.253822438708073,1
风和投资管理咨询（上海）有限公司,2.253822438708073,1
北京盛洪觉文化传媒有限公司,2.253822438708073,1
北京广大时代文化传播有限责任公司,2.254233782650146,1
四川意境天地文化传媒有限公司,2.254233782650146,1
珠海大卫文化传播有限公司,2.254233782650146,1
北京星光影美影视器材有限公司,2.254233782650146,1
百灵时代传媒集团有限公司,2.254233782650146,1
浙江视通文化传播有限公司,2.257390549337303,1
杭州新鼎明影视投资管理有限公司,2.257390549337303,1
北京东海麒麟文化传播有限公司,2.257390549337303,1
金港国际电影制作公司,2.2640382259931204,1
天极数码制作有限公司,2.2640382259931204,1
金向有限公司,2.2640382259931204,1
北京百衲龙图文化有限公司,2.2640382259931204,1
华纳世纪文化产业,2.2640382259931204,1
无锡光合映画影视文化有限公司,2.2683673254214836,1
蓝海娱乐有限公司,2.2683673254214836,1
北方联合影视集团有限公司,2.2723058444020863,1
中广文博（北京）投资有限公司,2.2723058444020863,1
北京一声春雷影业有限公司,2.2723058444020863,1
北京润喜影视文化传播有限公司,2.273417994771454,1
北京朱雀玄武影视文化传播有限公司,2.273417994771454,1
北京照山河文化传播公司,2.2758409399046684,1
香港晶艺电影事业有限公司,2.280760426326266,1
陕西龙品文化传媒有限公司,2.285309713090267,1
北京盛世德合国际文化传播有限公司,2.2854222741882464,1
北京合拍欣喜影视文化传媒有限公司,2.2854222741882464,1
上海麦丹影视文化有限公司,2.2933404526486956,1
杭州年糕文化艺术策划有限公司,2.2933404526486956,1
上海荣仕广告有限公司,2.2933404526486956,1
杨议影视文化传播有限公司,2.3074960379132126,1
北京德俊文化发展有限公司,2.316012304249463,1
东阳秋水堂影视有限公司,2.316012304249463,1
北京厚生文化传媒有限公司,2.328114460158389,1
广东环球数码动画制作有限公司,2.3291130026818196,1
焦点电影公司,2.3294792383874894,1
Film4 ,2.3294792383874894,1
Cowboy Films ,2.3294792383874894,1
Etalon film ,2.3294792383874894,1
英国第四影片公司,2.3294792383874894,1
台湾文创一号股份有限公司,2.3311234878466514,1
北京百世嘉文化有限公司,2.3311234878466514,1
三映电影文化有限公司,2.3311234878466514,1
深圳市海元梦想文化传媒有限公司,2.331589240955137,1
北京金强盛世文化传播有限公司,2.334715053464358,1
深圳市卡普辛一号影视传媒有限公司,2.349122047476353,1
北京数字领海电影科技有限公司,2.3496659840966294,1
北京赛轮伟业科技发展有限公司,2.3496659840966294,1
湖南广播电视台经视频道,2.3498794872316275,1
果实戏剧工作室,2.3498794872316275,1
北京盛唐明象国际文化传播有限公司,2.353127286608135,1
北京科影国际影视策划有限公司,2.3617467179758966,1
北京卡酷传媒有限公司,2.3617467179758966,1
中国数字文化集团有限公司,2.3617467179758966,1
北京中教鸿兴文化传媒有限公司,2.3617467179758966,1
北京嘉合映画影视文化传媒有限公司,2.365338202346941,1
贵州铜仁市文体广电新闻出版局,2.365338202346941,1
贵州铜仁市万山区人民政府,2.365338202346941,1
松桃九龙民族文化旅游开发有限公司,2.365338202346941,1
武汉数字领海电影科技有限责任公司,2.366348233467718,1
北京英立成文化传播有限公司,2.3674677421179733,1
北京銮腾星光文化传媒有限公司,2.3674677421179733,1
中申联合有限公司,2.3674677421179733,1
深圳市聚丰环保科技有限公司,2.3674677421179733,1
上海华瀚捷晟影视投资有限公司,2.3679705810433935,1
迦南天成广告（北京）有限公司,2.3679705810433935,1
北京瑞盛太合文化传媒有限公司,2.3685471975676564,1
中联智诚国际传媒广告（北京）有限公司,2.3685471975676564,1
鸿臣影视制片厂,2.3694385154421425,1
中政影业文化（北京）股份有限公司,2.3746383841201877,1
天籁锐联（北京）文化传媒有限公司,2.37489491856698,1
北京世纪美名广告有限公司,2.37489491856698,1
香港电影发展基金会,2.375736752135848,1
浙江天光地影影视制作有限公司,2.380735697415691,1
中共云南省委宣传部,2.380735697415691,1
中共红河州委宣传部,2.380735697415691,1
中共弥勒市委宣传部,2.380735697415691,1
天津逗友文化传播有限公司,2.3823773034681137,1
Bang Singapore ,2.3823773034681137,1
A Grand Elephant ,2.3823773034681137,1
鼎立娱乐,2.3832766504076504,1
北京歌华传播中心有限公司,2.3842637857228026,1
千色映画（北京）国际广告传媒有限公司,2.3842637857228026,1
广州海力动漫文化发展有限公司,2.398061594105804,1
北京新锐兄弟影视文化传媒有限公司,2.3987557157733677,1
索宝（北京）国际影业投资有限公司,2.3987557157733677,1
武汉华宇丰文化发展有限公司,2.401176442169203,1
北京利久德长投资管理有限公司,2.401176442169203,1
西安盛和星影业,2.4024333462193117,1
兴河文化传媒投资有限公司,2.4024333462193117,1
北京锐奇伟业国际文化传媒有限公司,2.4191623955848853,1
红色树林文化传媒（北京）有限公司,2.4195096658221407,1
金马伯乐亚洲影视文化传媒（北京）有限公司,2.4195096658221407,1
中视国文（北京）文化传媒有限公司,2.4204178692863167,1
深圳市城市文化发展有限公司,2.4213077160033496,1
南京向天歌传媒有限公司,2.4213077160033496,1
星木映像股份有限公司,2.4223599936000717,1
北京九州盛世文化传播有限公司,2.432006687269598,1
北京天润恒创科技有限公司,2.432006687269598,1
北京大众明天文化传媒有限公司,2.432006687269598,1
兴扬电影有限公司,2.434265430560304,1
北京中金源影视文化传播有限公司,2.434265430560304,1
星光联盟影业无锡有限公司,2.437877345621435,1
黑龙江电影制片厂有限公司,2.438795415721323,1
北京中外世纪影视文化传播有限公司,2.44021617608011,1
海宁火星人文化传播有限公司,2.44021617608011,1
亚德文化创意股份有限公司,2.44021617608011,1
香港星汇影视有限公司,2.44021617608011,1
北京蓝海龙文化传播有限公司,2.44021617608011,1
日舞国际娱乐股份有限公司,2.447235577004759,1
金是传媒行销企业有限公司,2.447235577004759,1
犀利电影股份有限公司,2.447235577004759,1
王佩华工作室有限公司,2.447235577004759,1
北京力乙山文化传媒有限公司,2.4508954486902423,1
合肥橙空文化传播有限公司,2.4508954486902423,1
迅理影业（上海）有限公司,2.4549972173094594,1
北京紫微光文化传媒有限公司,2.4549972173094594,1
深圳市深投文化投资有限公司,2.4561533893746934,1
北京华艺天鑫文化发展有限公司,2.4561533893746934,1
