宁波新贵影视文化有限公司,2.463086333024533,1
华翔集团股份有限公司,2.463086333024533,1
三生（中国）健康产业有限公司,2.463086333024533,1
广州市耀辰影视传媒有限公司,2.463086333024533,1
上海灿星文化传媒有限公司,2.464459738965453,1
浙江卫视电视台,2.464459738965453,1
湖南乐田电影媒体有限公司,2.468480257357612,1
扬州岭南文化发展有限公司,2.479229694812041,1
浙江东阳燕南影视有限公司,2.479229694812041,1
北京锦心鼎力文化传媒有限公司,2.4821730047136583,1
浙江东世天承影视制作有限公司,2.485195981431776,1
北京传灯文化投资有限公司,2.4856930402936612,1
北京光延时代（北京）文化传媒有限公司,2.4856930402936612,1
北京锦绣映画影视文化传播有限公司,2.4856930402936612,1
北京新影世纪影视文化发展有限公司,2.4856930402936612,1
捷成宏禧文化传播股份有限公司,2.4856930402936612,1
北京世纪传灯文化投资有限公司,2.4856930402936612,1
西安龙氏影视文化传播有限公司,2.4886776021945773,1
北京红布衫文化发展有限公司,2.4886776021945773,1
浙江亿和影视制作有限公司,2.4886776021945773,1
北京六顺腾达文化传媒有限公司,2.4886776021945773,1
恒娱星空（北京）文化传播有限公司,2.4892270122227367,1
北京泰阁映画影视发行有限公司,2.4892270122227367,1
海南欢歌唱响文化传播有限公司,2.4922294153654994,1
闻世纪影视投资控股（北京）有限责任公司,2.4922294153654994,1
海口岛之国文化传媒有限公司,2.4922294153654994,1
海南中润国际文化传媒产业投资有限公司,2.4922294153654994,1
一格畅想国际文化传媒产业投资有限公司,2.4922294153654994,1
北京华映世纪民族电影电视剧制作中心,2.4989167640651666,1
上海锦瑟天下影视有限公司,2.5073430475999383,1
大卫传媒投资有限公司,2.5073430475999383,1
国民信托有限公司,2.5073430475999383,1
浙江自在影业有限公司,2.5073430475999383,1
上海以观传播有限公司,2.5073430475999383,1
凤凰影视文化有限公司,2.5098205822122797,1
无锡勋奇影视文化有限公司,2.5098205822122797,1
苏州中茵集团有限公司,2.5098205822122797,1
武汉硕博投资有限公司,2.5098205822122797,1
无锡华西文化产业有限公司,2.5098205822122797,1
无锡国融投资有限公司,2.5098205822122797,1
上海心悦禅边投资管理有限公司,2.5098205822122797,1
无锡国家数字电影产业园,2.5098205822122797,1
北京美特美文化传媒有限公司,2.5121505369220305,1
荣诚国际文化传媒（北京）有限公司,2.5135372084340646,1
秀诚文化传媒（北京）有限公司,2.5135372084340646,1
浙江永乐影视制作有限公司,2.5136436923090377,1
理想文化产业有限公司,2.5136436923090377,1
北京艾美斯特影视文化有限公司,2.5142023047108,1
贵州都市虎子传媒有限责任公司,2.5142023047108,1
浙江泰皇影视文化有限公司,2.5160591737582823,1
上海盛星文化传播有限公司,2.5175785420973846,1
感动人生（北京）文化有限公司,2.5192502998395265,1
上海琼洲影业有限公司,2.5192502998395265,1
壹彤国际文化传媒（北京）有限公司,2.5215826155303267,1
七星影视文化传媒（北京）有限责任公司,2.5330726600488123,1
未来寰宇文化传媒（北京）有限公司,2.5330726600488123,1
七星影视传媒（北京）有限公司,2.5330726600488123,1
未来新影文化传媒（北京）有限公司,2.5330726600488123,1
北京中拓国际拍卖有限公司,2.5330726600488123,1
北京师大资产经营有限公司,2.5330726600488123,1
红堂映画（北京）影视文化传媒有限公司,2.5330726600488123,1
北京必然秀文化传媒有限公司,2.5344576463314263,1
上海轩煌影视文化传媒有限公司,2.534635214826253,1
江苏省演艺集团有限公司,2.5372396493810405,1
华建传媒集团有限公司,2.5372396493810405,1
美感（上海）文化传媒有限公司,2.5390509943399295,1
西安幻象影视文化有限公司,2.5390509943399295,1
北京龙宏源文化投资管理有限公司,2.5390509943399295,1
陕西杨家将影视文化有限责任公司,2.540654760910119,1
北京诚成时代国际文化发展有限公司,2.540654760910119,1
北京烽云兴源文化传媒有限公司,2.540654760910119,1
北京金马车影视文化艺术有限公司,2.5450595846940027,1
中视东海（北京）国际文化传媒有限公司,2.5450595846940027,1
北京影硕文化传媒有限公司,2.5468386724514693,1
北京比格魔威文化传播有限公司,2.5468386724514693,1
北京泰丰时代文化发展有限公司,2.5472330375018624,1
此刻影视文化（北京）有限公司,2.5502650524465698,1
德晋荣誉（北京）文化有限公司,2.5502650524465698,1
越荣誉（北京）文化有限公司,2.5502650524465698,1
上海兆D影视传媒有限公司,2.551303581896227,1
北京华升顶峰影视传媒有限公司,2.551303581896227,1
北京华升顶峰影视文化传媒有限公司,2.551303581896227,1
北京缔久印象文化传媒有限公司,2.5562542431438247,1
希版图（北京）文化传媒有限公司,2.556423121371285,1
内蒙古电影集团有限责任公司,2.5583485087616196,1
荷意影业发展（天津）有限公司,2.5674263448525734,1
万程影业制作有限公司,2.5674263448525734,1
湖南昭宁影视文化传媒公司,2.58029758843657,1
北京喜迎盛世影视文化发展有限公司,2.583142073859931,1
北京文星宇文化传媒有限公司,2.583142073859931,1
北京浩美百世文化发展有限公司,2.583142073859931,1
志存高远（北京）文化传媒有限公司,2.583142073859931,1
北京虎兔马影视文化发展有限公司,2.583142073859931,1
亚美世纪影视文化（北京）有限公司,2.583142073859931,1
鼎龙达（北京）国际文化传媒有限公司,2.5836407809430417,1
广州爱动影视科技有限公司,2.5836407809430417,1
广东中冠贸易有限公司,2.5836407809430417,1
广东粤动传媒有限公司,2.5836407809430417,1
爱动漫工作室,2.5836407809430417,1
东阳文瀚影视广告有限公司,2.5852124903008824,1
浙江至诚果然文化发展有限公司,2.5852124903008824,1
北京红色果实文化传播有限公司,2.5872393817299897,1
稼轩环球影业有限公司,2.5872393817299897,1
拉近影业有限公司,2.5872393817299897,1
深圳前海潮润文化有限公司,2.5872393817299897,1
奇想娱乐电影有限公司,2.5872393817299897,1
北京拉近影业有限公司,2.5872393817299897,1
海南广播电视总台,2.589122650205851,1
陕西文化产业投资控股（集团）有限公司,2.589122650205851,1
陕西文投（影视）艺达投资有限公司,2.589122650205851,1
华娱时代影业（北京）投资股份有限公司,2.589122650205851,1
海南广电传媒影视有限公司,2.589122650205851,1
北京梦工作文化艺术有限公司,2.589122650205851,1
深圳前海普惠众筹交易股份有限公司,2.589122650205851,1
广东南方领航影视传播有限公司,2.589122650205851,1
杭州道玄影视科技有限公司,2.589122650205851,1
北京光影奇迹影视文化有限公司,2.5960029703843888,1
共青团中央网络影视中心,2.6026675783908524,1
华数传媒网络有限公司,2.605735893876746,1
茅迪影视文化有限公司,2.605735893876746,1
上海米子影视制作有限公司,2.605735893876746,1
杭州南广影视制作有限公司,2.605735893876746,1
k&q株式会社,2.605735893876746,1
海颂传媒（中国）股份有限公司,2.606746706755346,1
北京今典影业有限公司,2.606757447446635,1
北京东西音乐艺术制作有限公司,2.606757447446635,1
辽宁欧谷数字科技有限公司,2.606757447446635,1
深圳市中数文创资本管理有限公司,2.606757447446635,1
东越国际文化传媒（北京）有限责任公司,2.606757447446635,1
德方财富投资管理（大连）有限公司,2.606757447446635,1
华闻影业（上海）有限公司,2.6072834161860983,1
讯理影业（上海）有限公司,2.6072834161860983,1
北京海润华夏影视制作发行有限公司,2.6126673230547413,1
天津新月影视传媒有限公司,2.6126673230547413,1
星光麦特国际传媒有限公司,2.6159395359242024,1
深圳市文化影视有限公司,2.6159395359242024,1
上海鹏华影视文化有现公司,2.6159395359242024,1
东阳影响力电影发行有限公司,2.6159395359242024,1
上海彭鹏华影视文化工作室,2.6159395359242024,1
爱迪影业,2.6164965191596345,1
盛通影业,2.6164965191596345,1
掌趣影业,2.6164965191596345,1
北京盛通影业有限公司,2.6164965191596345,1
樱果无限（北京）文化传播有限公司,2.6164965191596345,1
衡水衡旅投资管理有限公司,2.6164965191596345,1
北京联盛嘉华影视文化传播有限公司,2.6164965191596345,1
吉林纪元时空动漫游戏科技集团股份有限公司,2.626093889228867,1
吉林天博影视制作股份有限公司,2.626093889228867,1
吉林炫通网络科技股份有限公司,2.626093889228867,1
广州塔秀动漫科技有限公司,2.626699564107673,1
广州金域投资有限公司,2.626699564107673,1
北京盛世华锐电影投资管理有限公司,2.6279288452168483,1
北京五紫龙影视传媒有限公司,2.6292158564771797,1
北京环影华艺文化传媒有限公司,2.6292158564771797,1
北京小猪哼哼文化传媒有限公司,2.6292158564771797,1
北京银海龙舟国际影视文化发展有限公司,2.6292158564771797,1
中瀚大地影业文化传媒（北京）有限公司,2.6292158564771797,1
乐田娱乐（湖南）有限公司,2.6292158564771797,1
北京笨鸟高飞影视文化有限公司,2.6295319183492403,1
北京玖门肆城影视文化有限公司,2.6295319183492403,1
上海满满额文化传播有限公司,2.6326192366191177,1
山东电影制片厂,2.6343865727479776,1
山东沃航文化传媒有限公司,2.6343865727479776,1
广东小猪班纳服饰股份有限公司,2.635986111800833,1
江苏众道影业投资有限公司,2.645481219350119,1
北京电影学院,2.646099711737442,1
北京艾易美迅动画制作有限公司,2.646099711737442,1
北京必合氏嘉文化传媒有限公司,2.646099711737442,1
渝乐（北京）文化传媒有限公司,2.6476763132408707,1
上海梵摩影视制作有限公司,2.6544653335201454,1
上海开圣影业文化传媒有限公司,2.6544653335201454,1
开圣佳视（北京）文化传播有限公司,2.6544653335201454,1
Film i Vast ,2.6562611517083408,1
Filmgate Films ,2.6562611517083408,1
上海大锂文化传播有限公司,2.662644522688827,1
上海平台投资有限公司,2.662644522688827,1
上海紫竹文化传媒有限公司,2.662644522688827,1
江苏糖心文化传媒有限公司,2.664688974580239,1
湖南广播电视台电视剧频道,2.670755942215133,1
炫彩互动网络科技有限公司,2.671977717314126,1
狮子山制作有限公司,2.6727626510474356,1
壹马时代传媒（北京）有限公司,2.6727626510474356,1
萌影画（北京）文化传播有限公司,4.366863379287387,2
深圳善为影业股份有限公司,4.371623588307709,2
北京东方光魔影视文化有限责任公司,4.38030840423228,2
新圣堂（天津）文化,4.38656620018978,2
火红电影有限公司,4.396580452015689,2
北京橙天嘉禾影视制作有限公司,4.398480629250055,2
上海腾讯影业文化传播有限公司,4.40031137188329,2
华策克顿集团上海剧酷文化传播有限公司,4.40031137188329,2
上海拾谷影业有限公司,4.40031137188329,2
泰洋川禾文化传媒有限公司,4.40031137188329,2
北京中联华盟文化传媒投资公司,4.40031137188329,2
东阳易星传媒有限公司,4.40226310242942,2
派格太合环球传媒,4.404341180023936,2
名威影业公司,4.404341180023936,2
NetFlix ,4.404341180023936,2
虎童基金,4.404341180023936,2
Yucaipa Films ,4.404341180023936,2
Film 44 ,4.404341180023936,2
美国韦恩斯坦公司,4.404341180023936,2
美国韦恩斯坦影业公司,4.404341180023936,2
北青传媒股份有限公司,4.410653926838591,2
美亚娱乐资讯集团有限公司,4.412809858566315,2
蓝色光标传播集团,4.412809858566315,2
上海剧酷文化传播有限公司,4.417127608989804,2
北京星光灿烂影视文化有限公司,4.419636267689829,2
中影新锐（北京）影视文化发展有限公司,4.421114576471849,2
北京天工异彩影视科技有限公司,4.422916340679664,2
韦恩斯坦公司,4.431088784801865,2
北京快乐新升文化传播有限公司,4.435219060523327,2
韩国希杰娱乐株式会社,4.436119374519056,2
北京广电影视传媒有限公司,4.439148829905429,2
北京鲜花盛开影业有限公司,4.442721777680606,2
北京新浪互联信息服务有限公司,4.442721777680606,2
上海创展文化传媒有限公司,4.442721777680606,2
北京云图影视文化传媒有限公司,4.442721777680606,2
深圳市百誉影业投资有限公司,4.442721777680606,2
北京文传世纪文化传媒有限公司,4.444476064218819,2
CJ E&M ,4.444476064218819,2
株式会社,4.444476064218819,2
威望国际娱乐股份有限公司,4.444476064218819,2
天下无敌国际有限公司,4.444476064218819,2
北京快乐星文化传播有限公司,4.44450275068167,2
百姓电影有限公司,4.44450275068167,2
北京完美蓬瑞影视文化有限公司,4.446720103825252,2
天津超导影视文化有限公司,4.446720103825252,2
重庆太合电影投资合伙企业,4.446720103825252,2
天津世纪乐成文化传播有限公司,4.448224000757396,2
福斯国际制作公司,4.4489624935363725,2
北京标准影像文化传播有限公司,4.449896755677574,2
中国星娱乐有限公司,4.451716451693728,2
帼星电影文化产业（北京）有限公司,4.453846054107671,2
Village Roadshow Pictures ,4.455344240018875,2
美国威秀影片公司,4.455344240018875,2
Jerry Weintraub Productions ,4.455344240018875,2
Dark Horse Entertainment ,4.455344240018875,2
杰瑞・韦恩特拉波制片公司,4.455344240018875,2
ratpac-dune娱乐公司,4.455344240018875,2
Beagle Pug Films ,4.455344240018875,2
上海世茂文化传媒有限公司,4.457577481288488,2
宇际星海传媒,4.4654726756748175,2
华联国际,4.4719691806246145,2
玉春雷娱乐文创股份有限公司,4.4719691806246145,2
上海基美影业股份有限公司,4.4757307363279475,2
盛唐时代文化传播有限公司,4.477456400709977,2
乐视影业（香港）有限公司,4.47777408746926,2
Riche Productions ,4.478354490835012,2
riche/ludwig制作公司,4.478354490835012,2
大地时代电影文化传播(北京)有限公司,4.483916636842037,2
广东原创动力文化传播有限公司,4.490347483607521,2
盛合经纬文化传媒（香港）有限公司,4.492145098516958,2
峨眉电影集团有限公司,4.500910727287498,2
阳光七星娱乐媒体集团,4.500970750285374,2
时代华娱影视传媒投资有限责任公司,4.505602494484201,2
谷乐乐投资有限公司,4.505669734819855,2
北京万合天宜影视文化有限公司,4.505822884622964,2
上海亭东影业有限公司,4.505822884622964,2
北京新影联影业有限责任公司,4.506020408765351,2
Gerard Butler Alan Siegel Entertainment ,4.50638866377709,2
LHF Film ,4.50638866377709,2
北京百度糯米信息技术有限公司,4.506971276552073,2
联美电影公司,4.507874888522313,2
泽东电影公司,4.515572513605288,2
东阳市花儿影视文化有限公司,4.517515494986639,2
海洋星（北京）文化发展有限公司,4.517515494986639,2
周拓如（上海）影视文化工作室,4.517515494986639,2
北京星耀佳彤文化传播有限公司,4.517515494986639,2
北京裕禾佳成文化传媒有限公司,4.517515494986639,2
贵州幕域宸丰影视文化传媒有限公司,4.517515494986639,2
上海蔻依文化传播有限公司,4.517515494986639,2
合信中金投资管理公司,4.517642898744879,2
Illumination Entertainment ,4.522667713757321,2
照明娱乐公司,4.522667713757321,2
一壹国际影视文化传媒（北京）有限公司,4.523157689883599,2
北京微妙文化传媒有限公司,4.524808668148639,2
上海伟懋影视文化有限公司,4.524808668148639,2
北京海不扬波影视文化有限公司,4.524808668148639,2
长影集团有限责任公司,4.5274857994505915,2
霍尔果斯青春光线影业有限公司,4.53446690705444,2
中影寰亚音像制品有限公司,4.535601436067378,2
北京剧魔影业投资管理有限公司,4.541529322171492,2
Team Todd ,4.541932775462535,2
Tim Burton Productions ,4.541932775462535,2
Legend3D ,4.541932775462535,2
恒大影视文化有限公司,4.543488681491237,2
Mad Hatter Entertainment ,4.544644900481558,2
天津银河文化传媒有限公司,4.5458661426610005,2
云南广电传媒集团有限公司,4.5458661426610005,2
北京卓然影业有限公司,4.5458661426610005,2
乐华娱乐（中国）,4.5458661426610005,2
霍尔果斯春秋时代文化传媒有限公司,4.5458661426610005,2
霍尔果斯登峰国际文化传播有限公司,4.5458661426610005,2
春秋时代影业,4.5458661426610005,2
云南广电传媒集团,4.5458661426610005,2
云南金彩视界影业有限公司,4.5458661426610005,2
省广合众（北京）国际传媒广告有限公司,4.54886878167234,2
天津兰德天元股权投资合伙企业（有限合伙）,4.559428518392896,2
天津斯凯股权投资合伙企业（有限合伙）,4.559428518392896,2
武汉传奇人影视艺术有限公司,4.562219801650228,2
华谊兄弟太合影视投资有限公司,4.564643698102035,2
长城影视股份有限公司,4.564643698102035,2
宸铭影业（上海）有限公司,4.564643698102035,2
海宁壹线影视文化有限公司,4.564643698102035,2
君竹（上海）影视文化有限公司,4.564643698102035,2
捷成瑞吉影视传媒有限公司,4.564643698102035,2
深圳市东方富海投资管理有限公司,4.564643698102035,2
旗舰影业有限公司,4.564643698102035,2
旗舰影业,4.564643698102035,2
北京诺丁山文化传播有限公司,4.5673821300267425,2
Nickelodeon Movies ,4.568422219254507,2
Gama Entertainment Partners ,4.568422219254507,2
Platinum Dunes ,4.568422219254507,2
美国尼克影业,4.568422219254507,2
Province of British Columbia ,4.568422219254507,2
Mednick Productions ,4.568422219254507,2
Canadian Film or Video Production Tax Credit Program ,4.568422219254507,2
China Movie Media Group ,4.568422219254507,2
Smithrowe Entertainment ,4.568422219254507,2
Gama Fi,4.568422219254507,2
北京荣信达影视艺术有限公司,4.569687635492964,2
麦特影视文化传媒（天津）有限公司,4.570103753575076,2
北京市电影股份有限公司,4.5703994355521855,2
北京玖阳晟禾科技有限公司,4.571379201816938,2
北京和合悦视文化传播有限公司,4.575787703982853,2
栀子花开（天津）文化传播有限公司,4.575787703982853,2
北京洪泰同创投资管理有限公司,4.575787703982853,2
北京光彩世纪文化艺术有限公司,4.575787703982853,2
北京快乐京林文化传播有限公司,4.575787703982853,2
千和影业（北京）有限公,4.575787703982853,2
艾肯娱乐公司,4.579593265360306,2
国盛影业（北京）有限公司,4.580695457086937,2
上海尚孰投资有限公司,4.5854844176523875,2
卡通先生影业有限公司,4.585561113253915,2
中国梦电影文化产业有限公司,4.590027744972976,2
广州英明文化传播有限公司,4.590321104680742,2
深圳吴氏影视娱乐有限公司,4.591895318929632,2
北京天华秀星文化传媒有限公司,4.591895318929632,2
Skydance Productions ,4.595209316356786,2
阿里影业,4.595209316356786,2
Perfect Storm Entertainment ,4.595209316356786,2
Sneaky Shark ,4.595209316356786,2
天空之舞制片公司,4.595209316356786,2
完美风暴娱乐,4.595209316356786,2
美国派拉蒙影业公司,4.595209316356786,2
美国天空之舞制片公司,4.595209316356786,2
美国完美风暴娱乐公司,4.595209316356786,2
美国狡猾鲨鱼制片公司,4.595209316356786,2
香港电视广播有限公司,4.595386311574043,2
大地时代电影发行（北京）有限公司,4.596454689660139,2
北京二十一世纪盛凯影视文化交流有限公司,4.598698277764591,2
20世纪福斯家庭娱乐电影公司,4.602903331870837,2
东申童画（北京）文化传播有限公司,4.607091243100242,2
大盛国际传媒（北京）有限公司,4.608695760344031,2
大盛国际传媒集团有限公司,4.608695760344031,2
上海爱美影视文化传媒有限公司,4.610602146839287,2
浙江巨擎投资有限公司,4.610602146839287,2
天马电影出品（香港）有限公司,4.61238942300903,2
Perfect World (Beijing) Pictures Co. ,4.6304807601259,2
Sur-Film ,4.6304807601259,2
肯尼迪/马歇尔电影制作公司,4.6304807601259,2
Double Negative ,4.6304807601259,2
Captivate Entertainment ,4.6304807601259,2
Pearl Street Films ,4.6304807601259,2
春秋时代（天津）影业有限公司,4.63489665048865,2
春秋时代（霍尔果斯）影业有限公司,4.63489665048865,2
广州长长影视文化有限公司,4.6372643182202715,2
江苏译林影视文化传媒有限公司,4.64093209416158,2
上海学禾文化传媒有限公司,4.64093209416158,2
香港影业国际有限公司,4.642050605627939,2
北京完美影视传媒股份有限公司,4.647352744514436,2
索尼电影娱乐公司,4.64846735140684,2
深圳大盛国际传媒有限公司,4.651858494757659,2
群星瑞智艺能有限公司,4.651858494757659,2
北京世纪乐成文化传媒有限公司,4.657490503720124,2
星光国际传媒（集团）有限公司,4.660108406488764,2
星光灿烂香港国际传媒有限公司,4.660108406488764,2
海宁壹颗心影视文化有限公司,4.660766375489323,2
再旦（北京）影视文化传媒有限公司,4.660766375489323,2
祥禾盛世国际影视文化传媒（北京）有限公司,4.660766375489323,2
北京好家伙国际影视文化发展有限公司,4.660766375489323,2
安迈进国际影业股份有限公司,4.661807954634784,2
北京登峰国际文化传播有限公司,4.665462223847945,2
南京军区政治部电视艺术中心,4.665462223847945,2
印纪影视娱乐传媒有限公司,4.665999794085847,2
北京春天融和影视文化有限责任公司,4.670957030863385,2
深圳华强数字动漫有限公司,4.674245714524502,2
深圳华强文化科技集团股份有限公司,4.674245714524502,2
华桦传媒,4.675507143646406,2
Shogakukan Inc. ,4.6773549705861415,2
朝日电视台,4.6773549705861415,2
霍尔果斯尚元影视投资有限公司,4.680926440770277,2
浙江淘宝网络有限公司,4.684654732730718,2
北京不亦乐乎电影文化发展有限公司,4.685718187561906,2
东阳一步到位影视有限公司,4.685718187561906,2
无锡旗开得胜影视有限公司,4.685718187561906,2
江苏幸福蓝海影业有限责任公司,4.688898616829881,2
海宁嘉行天下影视文化有限公司,4.690454541268388,2
北京蓝钻文化传媒有限公司,4.697581170598321,2
睦谷富投资集团,4.698472713126594,2
皮克斯动画工作室,4.698713086601356,2
橙子映像,4.699433323036778,2
上海汉涛信息咨询有限公司,4.699652265935049,2
乐视影业（天津）有限公司,4.700304190137413,2
北京果然影视文化有限公司,4.704504588539233,2
哥伦比亚电影制作（亚洲）有限公司,4.70776020222145,2
彼岸天（北京）文化有限公司,4.707935596087505,2
富士电视台,4.70854054835429,2
Dentsu ,4.712032582049323,2
星美影业有限公司,4.714044272415296,2
北京烈火影业有限公司,4.714044272415296,2
上海克顿文化传媒有限公司,4.714044272415296,2
Danjaq Productions ,4.715395490800308,2
北京剧角映画文化传媒有限公司,4.715790320066317,2
北京航美影视文化有限公司,4.720807448665226,2
优扬（天津）动漫文化传媒有限公司,4.723461418805052,2
东阳派格华创影视传媒有限公司,4.725901999340684,2
霍尔果斯彩条屋影业有限公司,4.735146087356722,2
北京龙乐东方影视文化传媒有限公司,4.738292019519142,2
Flynn Picture Company ,4.739787065407957,2
银河映像（香港）有限公司,4.741785001742808,2
索尼图形图像运作公司,4.749909998627525,2
寰宇娱乐有限公司,4.757086901574516,2
江苏省广播电视总台优漫卡通卫视,4.757457448267196,2
北京燕城十月文化传播有限公司,4.759377261136258,2
山东高路动画制作有限公司,4.759377261136258,2
恭梓兄弟,4.759377261136258,2
龙行盛世影视文化工作室,4.759377261136258,2
淮安西游产业集团有限公司,4.759377261136258,2
浙江永康壹禾,4.759377261136258,2
山东影视传媒集团,4.759377261136258,2
天空之城文化创意有限公司,4.764266345642971,2
20世纪福克斯公司,4.765244929720725,2
20世纪福克斯德国分公司,4.765244929720725,2
苛刻与不同寻常影业,4.771426372575002,2
DC Entertainment ,4.771426372575002,2
华纳兄弟影片公司,4.771426372575002,2
Cruel & Unusual Films ,4.771426372575002,2
北京果实创想影视文化有限公司,4.776445979167994,2
西安龙年影视文化传播有限公司,4.780243771143507,2
广东雅信文化传播有限公司,4.782805956975645,2
成龙英皇影业有限公司,4.788075277851956,2
北京影武者文化传媒有限公司,4.788075277851956,2
MGM-International Dist. ,4.789196657099818,2
寰亚电影制作有限公司,4.790618042456347,2
北京永旭良辰文化发展有限公司,4.792096408986434,2
世纪百年影业（天津）有限公司,4.793996520907701,2
北京光线传媒股份有限公司,4.797178733421898,2
万诱引力电影制作（香港）有限公司,4.797322118589656,2
Homeland Pictures Limited ,4.797322118589656,2
万诱引力乙有限公司,4.797322118589656,2
万诱引力甲有限公司,4.797605494052135,2
星光联盟影业（北京）有限公司,4.803835865552692,2
天津橙子映像传媒有限公司,4.806991684927319,2
奥飞影业投资（北京）有限公司,4.813363386550495,2
梦想者电影（北京）有限公司,4.814759588121557,2
北京华章东信文化投资有限公司,4.814759588121557,2
长江出版传媒股份有限公司,4.814759588121557,2
北京恒乐鲸影视文化发展有限公司,4.814759588121557,2
