兴化市创星文化艺术传媒有限公司,1.4121244061733171,3
大太阳（北京）影视制作有限公司,1.4121244061733171,3
秦州市凤城河风景区管委会,1.4121244061733171,3
江苏天宝置业有限公司,1.4121244061733171,3
秦州嘉捷置业有限公司,1.4121244061733171,3
秦州海林置业有限公司,1.4121244061733171,3
紫岚德纳影视文化传媒（北京）有限公司,1.4242280706959798,3
深圳市奥琪文体策划有限公司北京分公司,1.4420091591409518,3
北京岐波盛世文化传媒有限公司,1.448087666692341,3
北京真之影文化发展有限公司,1.448087666692341,3
苏州抹天印画文化发展有限公司,1.448087666692341,3
武汉光亚文化艺术发展有限公司,1.4641913706409995,3
湖北视纪印象科技股份有限公司,1.4641913706409995,3
北京燕昌荣新技术有限公司,1.4641913706409995,3
景德镇红都影业文化有限公司,1.4641913706409995,3
开化千和影视文化有限公司,1.4641913706409995,3
深圳旺发投资发展有限公司,1.4641913706409995,3
烟台清泉影视文化有限公司,1.4709981696608736,3
北京精点蓝数码电脑设计制作有限公司,1.4709981696608736,3
海霖动画制作有限公司,1.4787107555127592,3
东莞创意文化传播有限公司,1.4787107555127592,3
东莞海霖动画制作有限公司,1.4787107555127592,3
六合华纳（北京）文化传媒有限公司,1.4801507252732802,3
江西尚世星河影视传媒有限公司,1.4801507252732802,3
鑫奕祥龙国际文化传媒（北京）有限公司,1.4801507252732802,3
宁波市暴风动漫有限公司,1.4801507252732802,3
北京时越网络科技有限公司,1.498861688992884,3
北京艺亨东方教育科技有限责任公司,1.498861688992884,3
四川通达艺鑫影视文化传播有限公司,1.5130843604651438,3
重庆新博浪影视文化传媒有限公司,1.5153438930883807,3
重庆艾瑞斯影视传媒有限公司,1.5153438930883807,3
重庆天文星影视传媒有限公司,1.5153438930883807,3
北京华乐百合国际影视文化传媒,1.5153438930883807,3
北京世纪华文文化传播有限公司,1.515741416669365,3
山东传奇文化产业有限公司,1.515741416669365,3
滨州传奇文化产业有限公司,1.515741416669365,3
北京米灿文化传媒有限公司,1.5385737338068555,3
大唐风韵（北京）影视有限责任公司,1.54703589974001,3
贵州双龙实业集团有限公司,1.54703589974001,3
内蒙古天宇创新投资集团有限公司,1.54703589974001,3
长白山国际文化传媒有限公司,1.551205943747906,3
深圳市融资城影视资产管理中心有限公司,1.551205943747906,3
北京京程影视文化传播有限公司,1.551205943747906,3
北京博德金叶影视传媒有限公司,1.551205943747906,3
北京师范大学,1.551205943747906,3
北京师范大学教育基金会,1.551205943747906,3
北京丁荫楠影视文化传播中心有限公司,1.551205943747906,3
浙江浙影年代文化传播有限公司,1.5565437084835143,3
北京世纪喜讯文化发展有限公司,1.5602653978627146,3
天铭嘉业文化传媒投资有限公司,1.570075705321604,3
都市之窗（北京）文化传媒有限公司,1.570075705321604,3
浙江华友文化创意有限公司,1.5750723257138122,3
杭州奇门盾甲文化创意有限公司,1.5750723257138122,3
杭州黑奥文化艺术策划有限公司,1.5750723257138122,3
深海影视工作室,1.5750723257138122,3
源动力文化传媒有限公司,1.5750723257138122,3
山东龙视天下传媒集团有限公司,1.5788683286660283,3
上海星洲文化传媒有限公司,1.5847833789965076,3
善林(上海)金融信息服务有限公司,1.5847833789965076,3
北京名雅飞天影视文化传播有限公司,1.5857990090130007,3
文山百灵鸟影视摄制有限公司,1.5857990090130007,3
独山县人民政府,1.5860243823869755,3
泰唐健达影视制作有限公司,1.5860243823869755,3
北京三农汇丰食品有限公司,1.5860243823869755,3
河北鹏博传媒有限公司,1.5860243823869755,3
北京金亿乾坤影视文化传媒有限公司,1.5939502952639872,3
君艺尚（北京）文化传媒有限公司,1.5939502952639872,3
恒嘉天晟（北京）影业,1.5939502952639872,3
上海锐色文化传播有限公司,1.5939502952639872,3
北京东方每日文化传媒有限公司,1.5939502952639872,3
北京星耀龙福（国际）文化传播有限公司,1.5939502952639872,3
北京青山不老文化发展有限公司,1.5939502952639872,3
出品公司有恒嘉天晟（北京）影业,1.5939502952639872,3
重庆鼎盛影业公司,1.596377143997599,3
厦门蓝火焰影视公司,1.5979144712025282,3
乐众影业,1.5979144712025282,3
深圳同盈股权投资基金管理有限公司,1.6115108871266561,3
深圳市美亚文化传播有限公司,1.6115108871266561,3
深圳优美影视制作有限公司,1.6115108871266561,3
广州盛世华映文化传播有限公司,1.615634468877416,3
贵州盛世华映传媒有限公司,1.615634468877416,3
北京中亿影像国际文化传媒有限公司,1.6177340353640177,3
北京电影家协会,1.622731965164719,3
山东美雪畅联文化影视传媒有限公司,1.622731965164719,3
乐在（北京）文化传播有限公司,1.6268534146667255,3
影动亚洲有限公司,1.6306312440205,3
四川峨影影视传播有限责任公司,1.6333674451170068,3
成都宁歌文化传播有限公司,1.6333674451170068,3
北京蓝白红文化传媒有限公司,1.6333674451170068,3
广州金生江水文化传播公司,1.635081436010873,3
中国国际文化艺术中心,1.635081436010873,3
熙正照明有限公司,1.6399842480415883,3
唐城文化传媒股份有限公司,1.6451273992583908,3
海南仙寮投资有限公司,1.6471872978959894,3
北京宏德辉煌文化投资有限公司,1.6481647785740008,3
北京中博世纪影视传媒有限公司,1.6581068355063928,3
北京新华兆讯文化传媒有限公司,1.6581068355063928,3
新疆生产建设兵团广播电视台,1.6581068355063928,3
北京时代非鹭文化传播有限公司,1.6581068355063928,3
瀚草影视文化事业有限公司,1.669502834104343,3
北京半人马影视文化有限公司,1.6701530451921802,3
北京芒格投资管理有限公司,1.6701530451921802,3
北京天子安投资管理有限公司,1.6701530451921802,3
北京汇丰源影视文化传媒有限公司,1.6744018128452816,3
北京蒙太奇环球影业有限公司,1.6744018128452816,3
国家海洋局宣教中心,1.6744018128452816,3
中国电视艺术家协会,1.6744018128452816,3
广东惠东海龟国家级自然保护区管理局,1.6744018128452816,3
广西新农合投资发展有限公司,1.675686708699401,3
北京百思必达营销策划机构,1.675686708699401,3
北京中视汇影文化投资有限公司,1.6800634274819484,3
武汉世纪恒星影视文化发展有限公司,1.682686478249768,3
北京华夏影人影视文化有限公司,1.682686478249768,3
北京七宏佳艺文化发展有限公司,1.6925825622749089,3
海南七宏佳艺文化传媒有限公司,1.6925825622749089,3
北京梦想时刻影视文化传媒有限公司,1.6925825622749089,3
海南鹏达文化传播有限公司,1.6925825622749089,3
江苏大禾文化发展有限公司,1.6925825622749089,3
海南中视文化传播股份有限公司,1.6925825622749089,3
北京展翅上腾文化交流有限公司,1.6925825622749089,3
神州金马影视文化传媒,1.694254112025278,3
维格文化,1.6961815871685235,3
北京必合必达文化传播有限公司,1.6961815871685235,3
北京恩臣投资管理有限公司,1.6961815871685235,3
北京光影灵动文化传播有限公司,1.6961815871685235,3
上海红地毯文化传播有限公司,1.6999244027424765,3
山西飞播影视文化传媒有限公司,1.6999244027424765,3
杭州领星影视文化有限公司,1.7209031708134572,3
深圳前海财富动力影视基金管理有限公司,1.7209031708134572,3
杭州金康银电子工程有限公司,1.7209031708134572,3
北京大华影语文化传播有限公司,1.7254215500742585,3
高先电影有限公司,1.7314275870509477,3
河北志宝文化传媒有限公司,1.7318304202881623,3
北京上视之光影视科技有限公司,1.7318304202881623,3
北京华夏兄弟国际文化传媒有限公司,1.7382254481425048,3
咸宁市城市建设投资开发有限公司,1.7382254481425048,3
咸宁市旅游局,1.7382254481425048,3
上海佳泰文化有限公司,1.7431176252147413,3
天津滨海新区环宇影视传媒有限公司,1.7433529514095554,3
中国人民解放军后勤保障部金盾影视中心,1.7456212213069382,3
中国人民解放军总后勤保障部金盾影视中心,1.7456212213069382,3
中易泓德（北京）文化传媒有限公司,1.7456212213069382,3
山西子墨春秋影视文化有限公司,1.7456212213069382,3
北京缘鑫国际文化传媒有限公司,1.7498135852929375,3
河南暴风雨文化投资有限公司,1.7498135852929375,3
北京万森群星影视文化传播有限公司,1.7498135852929375,3
深圳市华浩文化传媒有限公司,1.755951041004132,3
天下乐田电影文化传媒（北京）有限公司,1.7560272129734409,3
北京云之国影音文化有限公司,1.7560272129734409,3
北京鹏讯文化科技有限公司,1.7560272129734409,3
北京缘起文化发展有限公司,1.766710207262259,3
湖北黄冈广电数字传媒有限公司,3.476995291054296,4
广东易美家园文化传媒有限公司,3.4795234854013284,4
Three T Productions ,3.4852627624131474,4
VGTRK ,3.4852627624131474,4
北京西河星汇影业有限公司,3.4886635056146744,4
中共重庆市委宣传部,3.4916179920317236,4
北京东方一处国际文化传媒有限公司,3.4916179920317236,4
北京天一璇烨文化传媒公司,3.4916179920317236,4
上海爱坚文化传媒有限公司,3.4916179920317236,4
杭州嘉艺影视传媒有限公司,3.4916179920317236,4
容盛文化传媒有限责任公司,3.495397235271872,4
中共河北省委宣传部,3.495397235271872,4
河北省广播电影电视局,3.495397235271872,4
中共石家庄市委宣传部,3.495397235271872,4
福建星宇文化传播有限公司,3.495397235271872,4
福州易货通文化传播有限公司,3.495397235271872,4
福建汉室电影有限责任公司,3.495397235271872,4
深圳市环球数码影视文化有限公司,3.49740931997597,4
北京天成翔业广告有限公司,3.501412582104961,4
深圳泽西年代影业有限公司,3.5035455574455097,4
北京随缘文化发展有限公司,3.504739919375595,4
浙江唐德影视股份有限公司,3.505674885867863,4
中影股份北京电影发行分公司,3.505674885867863,4
北京心海迦源文化交流中心出品,3.505674885867863,4
北京歌华有限电视网络股份有限公司,3.505674885867863,4
中投中财基金管理有限公司,3.505674885867863,4
爱若思国际传媒有限公司,3.505674885867863,4
天津孔雀山文化传媒有限公司联合出品,3.505674885867863,4
北京心海迦源文化交流中心,3.505674885867863,4
天津孔雀山文化传媒有限公司,3.505674885867863,4
广州弘光电影投资合伙企业,3.506991818723615,4
新视界文化传媒有限公司,3.506991818723615,4
上海中正达广投资管理有限公司,3.5104444674391986,4
欢乐电影（上海）有限公司,3.512042350468256,4
星焕蓝海制作有限公司,3.512042350468256,4
山西菲尔幕文化传媒有限公司,3.5131043490116785,4
海秀娱乐,3.5162576539417576,4
海秀传媒(天津)有限公司,3.5162576539417576,4
大庆百湖影视传媒有限责任公司,3.5162576539417576,4
法国乌迪亚纳制作有限公司,3.5162576539417576,4
海秀娱乐（香港）有限公司,3.5162576539417576,4
上海大万文化传播有限公司,3.520676073127419,4
骄阳电影有限公司,3.522582455397341,4
烟台文化发展投资基金有限公司,3.5231127669429094,4
北京中视达国际传媒有限公司,3.527228927741403,4
古京文化创意产业发展有限公司,3.527228927741403,4
北京博方文化传媒有限公司,3.527394003314161,4
霍尔果斯市千易志诚文化传媒有限公司,3.527394003314161,4
电影频道节目中心,3.527394003314161,4
霍尔果斯千易志诚文化传媒有限公司,3.527394003314161,4
北京沃森影视文化交流有限公司,3.5306900843249096,4
浙江恒扬文化传媒有限公司,3.532661396907025,4
韩国shincine,3.532661396907025,4
浙江星河恒扬文化传媒有限公司,3.532661396907025,4
西藏一格万象影视传媒有限公司,3.5346339467372667,4
武汉银都文化传媒股份有限公司,3.539010824196704,4
上海泓亮影视文化有限公司,3.540605983521502,4
上海盐商集团有限公司,3.540605983521502,4
上海梅卿传媒集团有限公司,3.540605983521502,4
拍板影视文化（上海）有限公司,3.540605983521502,4
深圳市前海华夏文化产业投资管理有限公司,3.540605983521502,4
上海海嵛广告有限公司,3.540605983521502,4
上海创丰投资管理股份有限公司,3.540605983521502,4
Venture Forth ,3.5440270946543224,4
Supersensory ,3.5440270946543224,4
Eden Rock Media ,3.5440270946543224,4
山西求索文化传播有限公司,3.54424048706173,4
北京东方画面影视文化有限公司,3.5451660406461825,4
Tokyo Broadcasting System (TBS) ,3.545326912914086,4
Film Face ,3.545326912914086,4
Kadokawa ,3.545326912914086,4
WoWow Inc. ,3.545326912914086,4
tbs电视台,3.545326912914086,4
Mainichi Broadcasting System (MBS) K.K. ,3.545326912914086,4
Asahi Shimbunsha ,3.545326912914086,4
Hokkaido Broadcasting Company (HBC) ,3.545326912914086,4
CBC Television ,3.545326912914086,4
FLaMmE ,3.545326912914086,4
RKB Mainichi Broadcastin,3.545326912914086,4
最后阶段娱乐公司,3.5457350135504355,4
Ram Bergman Productions ,3.5457350135504355,4
美国电影国度娱乐公司,3.5457350135504355,4
Endgame Entertainment ,3.5457350135504355,4
加拿大元娱乐公司,3.5464982447255746,4
Stoney Lake Entertainment ,3.5464982447255746,4
北京菲尔幕文化传媒有限公司,3.555296427170443,4
大银幕(北京)电影发行控股有限公司,3.5582776614724736,4
奥飞影业（上海）有限公司,3.5582776614724736,4
浙江浩宇互动文化传播有限公司,3.559064737874338,4
光影文化传媒有限公司,3.559064737874338,4
幕客影视传媒有限公司,3.559064737874338,4
千里同乐影视文化传媒（北京）有限公司,3.5622309879581557,4
浙江乐颂文化传媒有限公司,3.5622309879581557,4
北京乐韬世纪文化传媒有限公司,3.562837473178064,4
高雄人文化基金会,3.568261582154105,4
星宝环球有限公司,3.570749530853525,4
九龙品天影视文化无锡有限公司,3.570749530853525,4
阿里巴巴（娱乐宝）,3.570749530853525,4
枫海影业有限公司,3.5716797226239247,4
枫海科技,3.5716797226239247,4
果果传媒有限公司,3.5716797226239247,4
广州大名娱乐经纪有限公司,3.5720672969678984,4
佛山精鹰传媒股份有限公司,3.5728239897677776,4
北京奥宁腾威广告有限公司,3.5748284793081595,4
广东广视传媒有限公司,3.5748284793081595,4
北京雨木星辰文化传播有限公司,3.5748284793081595,4
天佑（北京）文化传媒有限公司,3.5748284793081595,4
上海磐石投资有限公司,3.588895521901728,4
Reel FX Creative Studios ,3.593043370415125,4
Mandoo Pictures Co. ,3.593043370415125,4
漫动时空（香港）有限公司,3.593043370415125,4
华谊腾讯娱乐有限公司,3.593043370415125,4
漫动时空文化发展（天津）有限公司,3.593043370415125,4
梦幻工厂文化传媒（天津）股份有限公司,3.593043370415125,4
天津画国人动漫创意有限公司,3.593043370415125,4
吉姆汉森科技发展（天津）有限公司,3.593043370415125,4
MANDOO Pitcures ,3.593043370415125,4
北京漫动时空文化传播有限公司,3.593043370415125,4
Nu Image Films ,3.5946543742156387,4
中影星美电影院线有限公司,3.5993775560063663,4
博智影业文化传媒（北京）有限公司,3.601565700173375,4
太阳亚洲集团有限公司,3.601565700173375,4
中国3d数码娱乐有限公司,3.601565700173375,4
北京昊月星涛体育文化传播有限公司,3.601565700173375,4
中共北京市委宣传部,3.605730510917235,4
北京市新闻出版广电局,3.605730510917235,4
北京顶峰传奇影视文化有限公司,3.6132920016473284,4
金银国（厦门）文化传媒有限公司,3.6132920016473284,4
深圳前海摩尔传媒有限公司,3.6132920016473284,4
北京网智天元科技股份有限公司,3.6132920016473284,4
台湾热窝文化传媒有限公司,3.6132920016473284,4
东莞先秦文化传播有限公司,3.6132920016473284,4
深圳市视界浪潮传媒有限公司,3.614895107802377,4
北京意合影视传媒有限公司,3.614895107802377,4
上海银润传媒广告有限公司,3.615753365313357,4
广州金川文化有限公司,3.6191006384050985,4
九龙品天（北京）文化传播有限公司,3.619725520407999,4
上海永旭文化传播有限公司,3.6227050473900726,4
时代天骄文化传媒有限公司,3.62570128943242,4
千年电影公司,3.626531291769761,4
北京佟悦名新文化传媒有限公司,3.6333482504728876,4
嘉铭影业,3.6333482504728876,4
江苏朱瓷影业有限公司,3.6333482504728876,4
天映娱乐有限公司,3.635555118052425,4
凯擘影艺股份有限公司,3.635555118052425,4
突围电影制片公司,3.635555118052425,4
上海灵岩文化传播有限公司,3.6401006412733925,4
峨眉电影集团,3.643442806044888,4
广东电视台,3.647451434568539,4
秀宝,3.6504678035954465,4
广东新华展望传媒有限公司,3.6544220270142778,4
环球数码媒体科技研究（深圳）有限公司,3.663084373868573,4
Hopscotch Features ,3.666258636817446,4
北京新力量影视文化有限公司,3.6699812983086884,4
天津市滨海新区青青树动漫科技有限公司,3.67082916038189,4
Silver Reel ,3.6729794120432486,4
浙江宁佑传媒有限公司,3.674026641004665,4
北京永利文化传媒有限责任公司,3.674762885417681,4
深圳市汇业金石有限公司,3.674762885417681,4
GyaO ,3.675961549642169,4
Kodansha Ltd. ,3.675961549642169,4
Nippon Shuppan Hanbai (Nippan) K.K. ,3.675961549642169,4
Shirogumi ,3.675961549642169,4
Yahoo Japan ,3.675961549642169,4
Robot ,3.675961549642169,4
Nippon Television Network (NTV) ,3.675961549642169,4
上海米家文化传播有限公司,3.679447884601105,4
合肥泰尚文化科技有限公司,3.6796222861957872,4
Disneynature ,3.679798433369162,4
川制作,3.679798433369162,4
迪士尼自然,3.679798433369162,4
西安曲江梦园影视有限公司,3.6821929273915286,4
陕西景浩泽影视文化有限责任公司,3.6821929273915286,4
北京东方天明文化传播有限责任公司,3.6821929273915286,4
北京启泰远洋文化传媒有限公司,3.6821929273915286,4
北京百瑞传奇影业有限公司,3.6831001955133815,4
阿德曼动画公司,3.6888556775956896,4
Anton Capital Entertainment (ACE) ,3.6888556775956896,4
Palm-Star Entertainment ,3.6902634347656784,4
PalmStar Entertainment (PalmStar Media Capital) ,3.6902634347656784,4
思美传媒股份有限公司,3.690486694180878,4
恒信玺利实业股份有限公司,3.690486694180878,4
北京盟将威影视文化有限公司,3.695496561328245,4
游族影业,3.695496561328245,4
文创基金,3.695496561328245,4
北京秦禾嘉业文化传媒有限公司,3.696000593424748,4
娱乐宝,3.699972067651165,4
群像文化传媒有限公司,3.7003462720383142,4
杭州天马影视文化有限公司,3.703528670264545,4
新华展望传媒有限公司,3.7037074134944135,4
四川省热窝文化传播有限公司,3.710465169337613,4
武汉星皓影视文化有限公司,3.7111692332163617,4
北京泽西年代影业有限公司,3.7133981301811767,4
河北影视集团有限公司,3.71652084783545,4
耀邦（厦门）投资有限公司,3.7168285538374644,4
（厦门）,3.7168285538374644,4
上海复逸文化传播有限公司,3.7190419372292935,4
北京瑞格嘉尚文化传播有限公司,3.7208643559193457,4
上海乐在其中影视传播有限公司,3.7235558191392566,4
岩上映画文化传媒（北京）有限公司,3.7247729750871703,4
湖南源点影视文化传播有限公司,3.7247729750871703,4
风山渐文化传播有限公司,3.7247729750871703,4
北京途古文化传媒有限公司,3.7247729750871703,4
深圳孙行者文化传媒有限公司,3.7247729750871703,4
郑州报业集团,3.7247729750871703,4
墨亚（厦门）文化传媒有限公司,3.7247729750871703,4
纵横汇（北京）信息技术有限公司,3.7247729750871703,4
福建中疆投资有限公司,3.7247729750871703,4
湖南汉竹高新科技股份有限公司,3.7247729750871703,4
上海艺言堂影视文化传播有限公司,3.7289184035421457,4
上海星蕴文化传播有限公司,3.7289184035421457,4
北京少城时代文化传播有限公司,3.7289184035421457,4
上海元都影视文化工作室,3.7289184035421457,4
上海舞心影视文化传播有限公司,3.7289184035421457,4
北京合众睿客影视文化传播有限公司,3.7289184035421457,4
芒果影视文化（湖南）有限公司,3.731609713951484,4
湖南志同道合影视文化有限公司,3.731609713951484,4
于正（上海）影视文化工作室,3.731609713951484,4
千和影业（北京）有限公司,3.7320107684549515,4
无锡杰翱影视文化传媒有限公司,3.7320107684549515,4
北京爱之甘醇文化艺术有限公司,3.7320107684549515,4
富能投资有限公司,3.7320107684549515,4
千和之源（北京）资本管理有限公司,3.7320107684549515,4
北京猿川影视文化有限公司,3.7337772748728466,4
金色环球传媒股份有限公司,3.7337772748728466,4
FilmNation Entertainment ,3.738919225275673,4
上海河马动画设计股份有限公司,3.739686242819982,4
北京万象传媒广告有限公司,3.742714921730327,4
上海淘米动画有限公司,3.74428202780838,4
北京追踪者文化传媒有限公司,3.749481227895369,4
阿荣企业有限公司,3.7498630307023286,4
英皇电影,3.7511997840955145,4
北京星美嘉映影业有限公司,3.751603163860577,4
江苏省广播电视总台,3.7539773448627574,4
土豆动漫,3.7539773448627574,4
国动动画,3.7539773448627574,4
领航传媒,3.7539773448627574,4
福建电视台少儿频道,3.7539773448627574,4
美亚长城传媒（北京）有限公司,3.75437203775602,4
武汉电视台少儿频道,3.7589542605246256,4
成都市广播电视台少儿频道,3.7589542605246256,4
青春光线影业有限公司,3.7659679136226605,4
台北影业股份有限公司,3.7675825270772965,4
东方星空创业投资有限公司,3.769004914035107,4
杭州玄机科技信息技术有限公司,3.769004914035107,4
上海骏梦网络科技有限公司,3.769004914035107,4
广东明星创意动画有限公司,3.7700607280457215,4
中国移动动漫基地,3.7720333040053617,4
辽宁亨通传媒股份有限公司,3.7743249578299953,4
天津磨铁娱乐有限公司,3.7743249578299953,4
百视通网络电视技术发展有限责任公司,3.7743249578299953,4
光点影业股份有限公司,3.776201966893105,4
Bazelevs Production ,3.7773695410425105,4
Mindstream Productions ,3.7773695410425105,4
Fox 2000 Pictures ,3.777597896366481,4
Regency Enterprises ,3.777597896366481,4
Bagdasarian Productions ,3.777597896366481,4
Sunswept Entertainment ,3.777597896366481,4
Paragon Studios ,3.777597896366481,4
天古数码艺术设计（上海）有限公司,3.7840078545730074,4
舞之数码动画制作有限公司,3.7840078545730074,4
ufo电影人制作有限公司,3.7842784250295485,4
峰威（上海）影视投资管理有限公司,3.7843240983959996,4
北京若水彤云影视文化传媒有限公司,3.784931667928655,4
东阳新视觉影视文化有限公司,3.784931667928655,4
北京希世纪影视文化发展有限公司,3.784931667928655,4
北京华图宏阳教育文化发展股份有限公司,3.784931667928655,4
广东浙银投资控股有限公司,3.784931667928655,4
上海慧宇投资发展有限公司,3.784931667928655,4
华泉中天文化发展有限公司,3.784931667928655,4
东阳万树影视传播有限公司,3.784931667928655,4
襄阳百纳影视文化有限公司,3.786419187553506,4
华视网聚（常州）文化传媒有限公司,3.7870791482165385,4
北京华美时空文化传播有限公司,3.7870791482165385,4
凯擘香港有限公司,3.7870791482165385,4
西安银都电影发行有限公司,3.7897618654197402,4
北京市广播电影电视局,3.7897618654197402,4
北京盛唐时代文化传播有限公司,3.7897618654197402,4
北京蓝色光标品牌管理顾问股份有限公司,3.7897618654197402,4
上海美术电影制片厂,3.790027467204133,4
美亚电影制作有限公司,3.792632586065021,4
蓝莓影业,3.7933307110117003,4
希云森林文化（北京）有限公司,3.7933307110117003,4
广州桦森影视有限公司,3.7951226426221685,4
Lakeshore Entertainment ,3.7964674808491155,4
上海聚力传媒技术有限公司,3.7964827470818223,4
英皇娱乐集团有限公司,3.7980709692949377,4
合一网络科技（北京）有限公司,3.7998538164927966,4
湖北省电影发行放映总公司,3.802035138951429,4
郡嘉影视,3.8021070677003497,4
重庆少儿频道,3.8021070677003497,4
辽宁电视台,3.8021070677003497,4
山东青少频道,3.8021070677003497,4
福建少儿频道,3.8021070677003497,4
杭州少儿频道,3.8021070677003497,4
宁波少儿频道,3.8021070677003497,4
妈妈网,3.8021070677003497,4
福建真恒业文化传播有限公司,3.8023392135179575,4
北京千橡网景科技发展有限公司,3.8023392135179575,4
北京风行在线技术有限公司,3.8023392135179575,4
北京聚合影联文化传媒有限公司,3.8040678394321623,4
上海电影制片厂,3.812741609330804,4
天津北方动漫集团股份有限公司,3.815743731311918,4
腾讯电影,3.820237594436937,4
魔方工作室,3.820237594436937,4
微票儿,3.820237594436937,4
云文（北京）影业投资有限责任公司,3.820290148999586,4
江西电影制片厂,3.8205600478456527,4
上海思远影视文化传播公司,3.8208737339693557,4
北京宣亚国际投资有限公司,3.8208737339693557,4
上海翡翠东方传播有限公司,3.8208737339693557,4
中视剧风（北京）文化传媒有限公司,3.8208737339693557,4
