十全十美娱乐传媒有限公司,2.8901470530032176,2
东方华影（北京）文化传媒有限公司,2.890985179145098,2
北京亿旺京闽科技集团有限公司,2.890985179145098,2
湖南若水文化传媒有限公司,2.8919498137303448,2
北京华瑞鑫艺国际文化传媒有限公司,2.892155845029916,2
北京嘉娱帝华文化传媒有限责任公司,2.892155845029916,2
东阳瞻龙瞩凤影视文化传播有限公司,2.892155845029916,2
北京中鼎华娱影视文化有限公司,2.892155845029916,2
华艺娱乐集团有限公司,2.8927233175960403,2
上海基美影业有限公司,2.8942662045887384,2
上海天幕星映文化传媒有限公司,2.899059547328757,2
天画画天（北京）文化传媒有限公司,2.9016272111240653,2
中共南平市委宣传部,2.90601701752105,2
福建省仙游美景影视文化传媒有限公司,2.90601701752105,2
四川挚友文化传播有限公司,2.90601701752105,2
三七互娱（上海）科技有限公司,2.90902620922724,2
北京每日视界先锋数码图像制作有限公司,2.915352339901578,2
北京每日视界影视动画股份有限公司,2.915352339901578,2
北京文化—摩天轮文化传媒,2.915352339901578,2
广州文化产业投资管理有限公司,2.9168275442768135,2
东莞立生投资有限公司,2.9168275442768135,2
北京乐观文泰传媒有限公司,2.919261190001174,2
壹马时代传媒（北京）有限公司,2.9202851126057094,2
春秋永乐影视文化投资（北京）有限公司,2.920441622643406,2
合一影业（香港）有限公司,2.920441622643406,2
上海刚泰影视传媒有限公司,2.920441622643406,2
广州蓝弧文化传播有限公司,2.920806593536635,2
北京缘鑫国际文化传媒有限公司,2.9226943246564314,2
海南春天文化传媒有限公司,2.9227825299814545,2
香港基金电影公司,2.9245945521207464,2
东阳英皇影视制作有限公司,2.926656219072205,2
视点特艺（北京）数字技术有限公司,2.926656219072205,2
美亚传媒,2.92834975723586,2
广州百田信息科技有限公司,2.92834975723586,2
弘图光合电影投资基金,2.92834975723586,2
深圳前海普惠众筹交易股份有限公司,2.9286057787969333,2
广东南方领航影视传播有限公司,2.9286057787969333,2
杭州道玄影视科技有限公司,2.9286057787969333,2
深圳市深影橙天院线有限公司,2.931361237044862,2
北京玖玖盛放影视文化有限公司,2.936166771514269,2
南京青卓影视文化传播有限公司,2.9394243963390365,2
北京执行力国际影视文化传播有限公司,2.9394243963390365,2
西藏影视发展有限公司,2.9394243963390365,2
北京欢乐无限文化传播有限公司,2.9394243963390365,2
北京环球嘉艺文化传媒有限公司,2.9394243963390365,2
北京中视美星传媒有限公司,2.941039116674959,2
重庆中闻凯帝影视传媒有限公司,2.9464571778187914,2
重庆费洛蒙影视文化传播有限公司,2.9464571778187914,2
北京艺鸿天成文化传媒有限公司,2.9464571778187914,2
力加太阳文化传播有限公司,2.9476836388882326,2
中共重庆市委宣传部,2.9525066927097376,2
北京东方一处国际文化传媒有限公司,2.9525066927097376,2
北京天一璇烨文化传媒公司,2.9525066927097376,2
上海爱坚文化传媒有限公司,2.9525066927097376,2
杭州嘉艺影视传媒有限公司,2.9525066927097376,2
华影亿时代国际影业（北京）有限公司,2.9533778858643527,2
北京盛世天禧国际文化艺术有限公司,2.9533778858643527,2
临颍喜盈盈影视传媒有限公司,2.9533778858643527,2
河北电影电视剧制作中心,2.954922371707811,2
北京数字后影视文化有限公司,2.954922371707811,2
北京胜利传奇影视文化有限公司,2.954922371707811,2
九龙品天（北京）文化传播有限公司,2.9589936650303255,2
中影动画产业有限公司,2.9619476238041047,2
上海华娱星库文化传播有限公司,2.9639813285116277,2
三和娱乐国际有限公司,2.9667938583779,2
深圳迅雷网络技术有限公司,2.9686183526046714,2
北京华博龙韵影视文化传媒有限公司,2.9693506700851615,2
北京交远传媒有限公司,2.970221312566254,2
北京金海岸数字图像科技有限责任公司,2.972716465104298,2
西安曲江影视集团,2.972716465104298,2
金海岸影业有限公司,2.972716465104298,2
北京利川同人投资公司,2.9767212864713253,2
北京真善美慧影业公司,2.9767212864713253,2
道盛奇正（北京）管理咨询有限公司,2.9767212864713253,2
杭州涌源文化艺术策划有限公司,2.9767212864713253,2
上海祥盛影视制作发行有限公司,2.980135231563874,2
承德非凡影视文化传媒有限责任公司,2.9834909718151663,2
浙江自在影业有限公司,2.989498762032593,2
广州嘉和影视制作有限公司,2.993925362941636,2
广州承兴营销管理有限公司,2.993925362941636,2
安华白云控股集团有限公司,2.993925362941636,2
厦门皓月文化传媒有限公司,2.995024999127847,2
印度科瑞恩电影公司,2.995771164511846,2
北京多声部影视文化有限公司,2.996494159926837,2
正在文化传媒（北京）有限公司,2.996494159926837,2
新鼎明影基金,2.997084807688541,2
北京南海影业公司,2.9989607938416287,2
北京和润德堂文化传媒股份有限公司,3.001564979987314,2
辽源关东盛京文化产业有限公司,3.0020407248664824,2
内蒙古巨典文化影视传媒有限公司,-1.9999999999999996,3
四川七国文化传播有限公司,-1.9999999999999996,3
北京星路志合文化传媒有限公司,-1.9999999999999996,3
秦皇岛众传广告传媒有限公司,-1.9999999999999996,3
东莞市捌毫米影视制作有限公司,-1.9999999999999996,3
深圳星海映像文化传播有限公司,-1.9999999999999996,3
贵州铜仁市文体广电新闻出版局,-1.9999999999999996,3
贵州铜仁市万山区人民政府,-1.9999999999999996,3
松桃九龙民族文化旅游开发有限公司,-1.9999999999999996,3
江苏荣耀文化教育有限公司,-1.9999999999999996,3
吉林省迷影文化传媒有限公司,-1.9999999999999996,3
广州春歌文化活动策划有限公司,-1.9999999999999996,3
台州皇家影视发展有限公司,-1.9999999999999996,3
青岛广和源影视发展有限公司,-1.9999999999999996,3
北京星辉佳业国际影视文化传媒有限公司,-1.9999999999999996,3
深圳市艺宝文化传播有限公司,-1.9999999999999996,3
独山影山文化传媒有限公司,-1.9999999999999996,3
乌鲁木齐隆博文化传媒广告有限公司,-1.9999999999999996,3
福州华文影视传媒有限公司,-1.9999999999999996,3
北京中广星媒影视文化有限公司,-1.9999999999999996,3
邯郸市天成影视制作有限公司,-1.9999999999999996,3
矛迪影视文化有限公司,-1.9999999999999996,3
杭州南广影视股份有限公司,-1.9999999999999996,3
云南云河之舟影业有限公司,-1.9999999999999996,3
大魏盛唐文化传媒有限公司,-1.9999999999999996,3
陕西邑天实业有限公司,-1.9999999999999996,3
北京零度中视国际文化传播有限公司,-1.9999999999999996,3
抚州市鸿文文化传媒有限公司,-1.9999999999999996,3
江西抚州鸿文文化传媒有限公司,-1.9999999999999996,3
南京明博文化传播有限公司,-1.9999999999999996,3
晋尚中天影视文化传播（北京）有限公司,-1.9999999999999996,3
吕梁市鑫晖文化传媒有限公司,-1.9999999999999996,3
东莞市群艺影视制作有限公司,-1.9999999999999996,3
珠海世纪星影业有限公司,-1.9999999999999996,3
河北瑞丰晟视文化传媒有限公司,-1.9999999999999996,3
影尚星光（北京）文化传媒有限公司,-1.9999999999999996,3
梅园艺影（北京）文化传媒有限公司,-1.9999999999999996,3
安徽传智文化传媒有限公司,-1.9999999999999996,3
阜阳市传媒业商会,-1.9999999999999996,3
温州天运纵横文化传播有限公司,-1.9999999999999996,3
湖北罗田电视台,-1.9999999999999996,3
北京中视美星国际文化传媒有限公司,-1.9999999999999996,3
桐乡百城映像文化传媒有限公司,-1.9999999999999996,3
浙江金沙影业有限公司,-1.9999999999999996,3
阳明中天（北京）影视传媒有限公司,-1.9999999999999996,3
坤元莲城影视文化传媒（北京）有限公司,-1.9999999999999996,3
北京市文博海纳影视文化有限公司,-1.9999999999999996,3
浙江省永康万适诚影视传媒有限公司,-1.9999999999999996,3
北京博纳时代影视传媒公司,-1.9999999999999996,3
永康星辉影业有限公司,-1.9999999999999996,3
北京鸿盟影视传媒有限公司,-1.9999999999999996,3
上海视骊影视制作有限公司,-1.9999999999999996,3
北京光影奇迹影视文化有限公司,-1.9999999999999996,3
阿巴嘎旗陶力嘎腾游牧文化旅游传媒有限责任公司,-1.9999999999999996,3
贵州西骏辉煌文化产业有限公司,-1.9999999999999996,3
成都市东阳文化传播有限公司,-1.9999999999999996,3
武汉大田影视文化传播有限公司,-1.9999999999999996,3
北京翰林苑国际文化传播有限公司,-1.9999999999999996,3
深圳诺亚星光文化传播有限公司,-1.9999999999999996,3
苏州市滑稽剧团,-1.9999999999999996,3
中国文学艺术界联合会,-1.9999999999999996,3
中国戏剧家协会,-1.9999999999999996,3
河南三川影业股份有限公司,-1.0,3
四川峨眉电影音像有限公司,-0.9586073148417749,3
成都白屋文化传播有限公司,-0.9586073148417749,3
北京星灿光芒影视传播有限公司,-0.9586073148417749,3
深圳狐狸猎犬互动娱乐有限公司,-0.9586073148417749,3
北京祥瑞万方影视文化传媒有限公司,-0.9586073148417749,3
杭州和山文化艺术有限公司,-0.9586073148417749,3
北京金鸟鸣影视文化有限公司,-0.9586073148417749,3
上海星洲文化传媒有限公司,-0.9586073148417749,3
善林(上海)金融信息服务有限公司,-0.9586073148417749,3
尚宝佳艺国际影视文化传媒（北京）有限公司,-0.9586073148417749,3
沈阳畅艺文化传媒有限公司,-0.6777807052660807,3
沃趣影业文化传媒（上海）有限公司,-0.6777807052660807,3
河南山川影视文化传播有限公司,-0.6575773191777937,3
北京弄影堂文化传媒有限公司,-0.6575773191777937,3
仙桃市大顺文化传媒有限公司,-0.5086383061657272,3
北京广播电视台,-0.38721614328026444,3
北京电视艺术中心有限公司,-0.38721614328026444,3
今典环球（北京）国际文化传媒有限公司,-0.38721614328026444,3
许昌隆盛影视文化传播有限公司,-0.38721614328026444,3
深圳艺宝文化传播有限公司,-0.38721614328026444,3
杰森（北京）影视文化发展有限公司,-0.38721614328026444,3
新疆电视台,-0.2924298239020636,3
贵州翰韵文化传媒有限公司,-0.2924298239020636,3
中艺博悦影业,-0.2924298239020636,3
山东道可道文化发展有限公司,-0.2924298239020636,3
章丘城市建设开发有限公司,-0.2924298239020636,3
四川飞马西南影视艺术发展中心,-0.2924298239020636,3
重庆同缘音画文化传播有限公司,-0.21467016498923294,3
北京正道恒业影视文化传媒有限公司,-0.21467016498923294,3
北京光成影视文化发展有限公司,-0.21467016498923294,3
山西世纪博奥影视文化有限公司,-0.21467016498923294,3
西安曲江美霖影视文化有限合伙企业,3.002731788423945,4
北京说说唱唱文化传媒有限公司,3.0037232697157275,4
万通影音科技股份有限公司,3.0037232697157275,4
浙江新长城动漫有限公司,3.007239808713795,4
广州虹猫蓝兔动漫科技有限公司,3.007239808713795,4
杭州古今时代电影制作有限公司,3.008561849969881,4
中国贵州茅台酒厂（集团）有限责任公司,3.009200105451731,4
潇湘电影集团有限公司,3.009200105451731,4
北京海盛文化发展有限公司,3.010049656258925,4
寰亚影视发行（香港）有限公司,3.0121240592059544,4
天津中外名人鼎恒影业发展有限公司,3.015112355086485,4
北京舸斐木影视文化有限公司,3.015112355086485,4
公安部金盾影视文化中心,3.016368861779009,4
西安深空影视传媒有限公司,3.0165779265789867,4
北京强大伟业文化产业有限公司,3.0165779265789867,4
深圳市比达广告传媒有限公司,3.0165779265789867,4
Moneff ,3.0165779265789867,4
北京中艺英纳文化传媒有限公司,3.0184966152836092,4
北京嘉艺华创影视制作有限公司,3.019660376063939,4
洁妮（北京）国际文化传媒有限公司,3.019660376063939,4
阿虎（北京）国际影视传媒文化发展有限公司,3.019660376063939,4
飞升国际娱乐有限公司,3.0252280130499183,4
无限动力实业有限公司,3.02538370352623,4
北京海平面影视文化传播有限公司,3.0275982873934564,4
群星瑞智国际娱乐股份有限公司,3.0285346533008077,4
居尔一拳有限公司,3.0285346533008077,4
北京海晏和清影视文化有限公司,3.0331341292795475,4
北京开泰伟业文化传媒有限公司,3.034351671127949,4
山西电影制片厂,3.034351671127949,4
西影集团股份有限公司,3.0389815924624735,4
合润传媒,3.0389815924624735,4
盛万上盈,3.0389815924624735,4
星润嘉业,3.0389815924624735,4
无锡光年动漫文化有限公司,3.04036891332774,4
浙江麦浪影业有限公司,3.0411991836059213,4
苏州影像巨魔影视投资管理有限公司,3.0416334544365125,4
河南影视制作集团,3.0418307068070995,4
大象出版社有限公司,3.0418307068070995,4
中共河南省委宣传部,3.0418307068070995,4
河南省广播电影电视剧,3.0418307068070995,4
湖南楚人传媒有限公司,3.043130330351467,4
深圳金蔷薇影视传媒有限公司,3.043130330351467,4
北京厚德雍和新媒体版权投资有限公司,3.043130330351467,4
北京圣基影业有限公司,3.043130330351467,4
湖南发条城市文化传媒有限公司,3.043130330351467,4
北京尚丰影视传媒有限公司,3.043130330351467,4
北京启泰文化发展集团,3.043130330351467,4
山西影视（集团）有限责任公司,3.0436019581462395,4
扬州富海国龙影视投资中心,3.0440338341582645,4
北京天悦东方文化传媒有限公司,3.0440338341582645,4
北京华丽视界文化传媒有限公司,3.0440338341582645,4
竣腾影业（北京）有限公司,3.0440338341582645,4
苏州诺伊曼实业有限公司,3.0440338341582645,4
骏腾影业（北京）有限公司,3.0440338341582645,4
大猩猩电影有限公司,3.0440338341582645,4
东莞市莞宣文化传播有限公司,3.0468111127504747,4
深圳比克非凡文化创意有限公司,3.0468111127504747,4
江苏真慧影业有限公司,3.0489115818674533,4
雪浪码头无锡传媒有限公司,3.0519277695736586,4
天昌投资集团,3.059907839250467,4
新影响文化投资集团,3.059907839250467,4
广西天昌投资有限公司,3.059907839250467,4
长景路电影工作室,3.059907839250467,4
Giraffe Pictures ,3.059907839250467,4
杭州潜影文化创意,3.06205901204768,4
旗帜（上海）数字传媒有限公司,3.06205901204768,4
上海华大影业有限公司,3.0636748046225435,4
珠海天娱影视制作有限公司,3.069153593521216,4
上海神兵天将影业有限公司,3.073043478709489,4
清影互动（北京）广告有限公司,3.0743811970031816,4
东海电影集团,3.0743811970031816,4
浙江强视传媒股份有限公司,3.075112449618513,4
北京强视文化发展有限公司,3.075112449618513,4
上海青童文化传播有限公司,3.0763527602770564,4
杭州寰耀影视文化传媒有限公司,3.0780252093027016,4
上海聚游网络科技传播有限公司,3.0794019563168167,4
上海映霸文化传播有限公司,3.0794019563168167,4
中共黑龙江省委宣传部,3.082932503024779,4
黑龙江广播电视台,3.082932503024779,4
黑龙江龙视文化传媒集团,3.082932503024779,4
北京凯视芳华文化传播有限公司,3.083147729374999,4
时代三和文化投资（北京）股份有限公司,3.083470369042582,4
上海锦瑟文化传播有限公司,3.083470369042582,4
深圳炫奇文化传播有限公司,3.083470369042582,4
上海观视文化传播有限公司,3.085108543219431,4
中国动漫集团公司,3.0865413420711323,4
中娱文化股份有限公司,3.0865413420711323,4
奥空动画公司,3.0865413420711323,4
香港电影发展基金会,3.087792062151693,4
大众点评网,3.0878204457887106,4
宽银慕电影制作有限公司,3.0886002697510535,4
北京天泽映画影视文化有限公司,3.08927262905587,4
光棍儿（北京）文化发展有限公司,3.090049852144588,4
浙江光棍儿影视文化有限公司,3.090049852144588,4
北京名雅飞天影视文化传播有限公司,3.09611713654971,4
香港橙天嘉禾娱乐（集团）有限公司,3.0964963677348787,4
宁波稻草家族影视策划有限公司,3.1013208164460164,4
中视新影影业投资发展有限公司,3.1040122690125664,4
北京灵动力量文化传媒有限公司,3.1040122690125664,4
上海鼎集文化传播有限公司,3.1080268959086945,4
上海广而视之文化传媒有限公司,3.1080268959086945,4
南通千寻文化传播有限公司,3.1080268959086945,4
海峡世纪（福建）影视文化有限公司,3.1083315784537455,4
江西凯天动漫有限公司,3.111568294513995,4
北京天生之道文化艺术有限公司,3.111803364140176,4
上海忧创影视文化有限公司,3.111803364140176,4
容丞和悦（北京）影视传媒投资有限公司,3.1141871569156314,4
星势力娱乐股份有限公司,3.1157469352545375,4
香格里拉音乐有限公司,3.1157469352545375,4
达芙妮国际控股有限公司,3.1157469352545375,4
稻草综合制作有限公司,3.1157469352545375,4
阿荣影业有限公司,3.1157469352545375,4
力荣影视器材有限公司,3.1157469352545375,4
北京华山论剑影视文化传媒有限公司,3.117009313874152,4
北京华艺宏泰文化发展有限公司,3.117009313874152,4
广东新华展望传媒有限公司,3.117569563463827,4
陕西文投（影视）艺达投资有限公司,3.1188629985190355,4
华娱时代影业（北京）投资股份有限公司,3.1188629985190355,4
海南广电传媒影视有限公司,3.1188629985190355,4
北京梦工作文化艺术有限公司,3.1188629985190355,4
北京溢通导明文化传播有限公司,3.1234890333353915,4
北京谷天传媒有限责任公司,3.1300795514088953,4
深圳市唐嘉淇文化传播有限公司,3.1307196365629517,4
北京华百灵国际传媒有限公司,3.1307196365629517,4
广州中喜企业管理咨询有限公司,3.138684709250121,4
佳景丽音文化传播有限公司,3.138684709250121,4
上海香蕉影画影视文化传媒有限公司,3.138684709250121,4
北京富宇世纪文化传媒有限公司,3.1398507619244347,4
天漫文化,3.140385467964948,4
松泽国际影业,3.1432365774900184,4
北京聚本文化传媒有限公司,3.1451684263271558,4
韵影制作有限公司,3.1534520388394762,4
上海青曦文化传播有限公司,3.15381791201441,4
Vendome Pictures ,3.154843760625724,4
TF1 ,3.154843760625724,4
Amazon Prime Instant Video ,3.154843760625724,4
法国映欧嘉纳影业公司,3.154843760625724,4
英国安东资本娱乐公司,3.154843760625724,4
studio canal,3.154843760625724,4
福建朱子影视文化发展有限公司,3.1564916050147778,4
富兰克林文创创业投资股份有限公司,3.1574023645829628,4
上海鹏锦影视文化有限公司,3.15824485474229,4
北京银狮影业文化传媒有限公司,3.1610713826622256,4
Arka Mediaworks ,3.1649028120784877,4
印度阿卡媒体公司,3.1649028120784877,4
北京梦禹山川影视文化传媒有限公司,3.169089299851594,4
北京冬春文化传播有限公司,3.1766410172926665,4
北京今典影业有限公司,3.1801516911096717,4
狮门影业家庭娱乐公司,3.1807765423708227,4
北京时代影响力影视文化有限公司,3.1833865891292543,4
北京星光大道影视制作有限公司,3.1835289191653664,4
喜羊羊电影工作坊有限公司,3.1846091057605643,4
北京风华年代文化传播有限公司,3.1853409673075745,4
秦皇岛岚锋文化传媒有限公司,3.1853409673075745,4
北京竹书酷乐文化传播有限公司,3.1853409673075745,4
Escape Artists ,3.1882730339654355,4
Fuqua Films ,3.1882730339654355,4
热烈工作室有限公司,3.1883968856809384,4
Big Farm ,3.189860723705999,4
Cartoon Saloon ,3.189860723705999,4
Digital Graphics ,3.189860723705999,4
Irish Film Board ,3.189860723705999,4
Mélusine Productions ,3.189860723705999,4
Noerlum Studios ,3.189860723705999,4
Super Productions ,3.189860723705999,4
Magellan Films ,3.189860723705999,4
Studio 352 ,3.189860723705999,4
海宁静观褀胜文化有限公司,3.191314053169262,4
上海红星美凯龙投资有限公司,3.191314053169262,4
北京麦锡尔文化传播有限公司,3.191314053169262,4
北京悠蓝文化传媒有限公司,3.191314053169262,4
卧虎藏龙国际文化传媒（北京）有限公司,3.1925228508427295,4
中钞国鼎投资有限公司,3.194597585242509,4
台湾得艺国际传媒股份有限公司,3.203641995784828,4
星光联盟文化发展（北京）有限公司,3.21181709712235,4
西安曲江文化产业风险投资有限公司,3.2142025255858857,4
北京合众天地文化传媒有限公司,3.2184330899688245,4
库里电影股份有限公司,3.2222767530045004,4
广东二十一世纪传媒股份有限公司,3.2222767530045004,4
海莱坞影视发展有限公司,3.2244191003849627,4
北京中视广经文化发展有限公司,3.2268859041171134,4
北京广义祯投资管理有限公司,3.2268859041171134,4
国视经典影视制作投资有限公司,3.2268859041171134,4
美国湖岸影业公司,3.2276065071525424,4
STX Entertainment ,3.2276065071525424,4
Vertigo Entertainment ,3.2276065071525424,4
上海豪颖文化传播有限公司,3.229197885927266,4
浙江博采传媒有限公司,3.2331002269971414,4
浙江博卡思教育软件有限公司,3.2331002269971414,4
杭州中国国际动漫节会展有限公司,3.2331002269971414,4
北京秋日极光品牌管理有限责任公司,3.2331002269971414,4
广东文化谷投资有限公司,3.2382744869860116,4
北京龙世纪文化传播有限公司,3.239276950298548,4
西部电影集团有限公司,3.239276950298548,4
北京好好影业有限公司,3.239727304967248,4
中国教育电视台,3.242364991386773,4
娱乐宝,3.2462523122993217,4
吉林禹硕动漫游戏科技股份有限公司,3.24966543146697,4
十美娱乐传媒（北京）股份有限公司,3.2511050614319976,4
HIT Entertainment Ltd. ,3.25447798497576,4
Arc Productions ,3.25447798497576,4
影一制作所股份有限公司,3.256816328773097,4
捷成瑞吉祥传媒有限公司,3.256816328773097,4
绍兴市文化产业发展投资有限公司,3.256816328773097,4
霍尔果斯捷成瑞吉祥影视传媒有限公司,3.256816328773097,4
东阳捷成瑞吉祥影视传媒有限公司,3.256816328773097,4
凤凰传奇影业,3.256816328773097,4
上海映迹影视策划有限公司,3.2587186753853365,4
蝴蝶时代影视文化有限公司,3.2587186753853365,4
TF1 Films Productions ,3.261638698063236,4
法国第4电视台,3.261638698063236,4
咪咕文化科技有限公司,3.263449056862965,4
强大娱乐,3.268510108068047,4
辽宁广播电视台,3.27218983145044,4
枫海影业有限公司,3.2727487287918993,4
枫海科技,3.2727487287918993,4
果果传媒有限公司,3.2727487287918993,4
芭乐互动（北京）文化传媒有限公司,3.27751982523844,4
浙江和文影视有限公司,3.27751982523844,4
东阳福添影视,3.27751982523844,4
秋风文化发展（北京）有限公司,3.27994285235531,4
二十一世纪威克影视传媒（天津）有限公司,3.27994285235531,4
四川星空影视文化传媒有限公司,3.27994285235531,4
业余时间影视投资有限公司,3.2803757433948535,4
河北玛西雅文化传播有限公司,3.2803757433948535,4
厦门美图网科技有限公司,3.2803757433948535,4
中辉华尚（北京）文化传播有限公司,3.2803757433948535,4
北京海华阳光影视文化传播有限公司,3.2803757433948535,4
星美传媒集团有限公司,3.2821166144770704,4
广州奥飞文化传播有限公司,3.2823524358264624,4
原子映象有限公司,3.2859441762888135,4
北京古舍国际文化有限公司,3.2867505406759236,4
航美传媒集团,3.2893949481291163,4
上海铭承影视制作有限公司,3.2936299005615512,4
非凡影界（北京）影视文化传媒有限公司,3.298593294993215,4
北京环球映画影视文化传媒有限公司,3.298593294993215,4
西安金金影视文化传媒有限公司,3.298593294993215,4
北京流金岁月文化传媒有限公司,3.298593294993215,4
电影国度娱乐公司,3.299661987195718,4
Circle of Confusion ,3.299661987195718,4
Likely Story ,3.299661987195718,4
Merced Media Partners ,3.299661987195718,4
Infinitum Nihil Production ,3.3030210079527578,4
北京电影学院,3.3036927271951173,4
北京嘉傲泰合影视文化传媒有限公司,3.3040184931073364,4
Sycamore Pictures ,3.306877316081669,4
浙江海缘影视有限公司,3.3077975860179767,4
中国海莱坞影视发展有限公司,3.3077975860179767,4
Gerard Butler Alan Siegel Entertainment ,3.3151324192815244,4
LHF Film ,3.3151324192815244,4
北京世纪蜘蛛文化传播有限公司,3.316203165587973,4
北京德稻教育投资有限公司,3.317605832093066,4
北京多宝树影视科技有限公司,3.317605832093066,4
香港龙在哪里有限公司,3.317605832093066,4
彩宏工程有限公司,3.317605832093066,4
十全媒体娱乐营销股份有限公司,3.3184619512320555,4
太拉制片公司,3.319149798997359,4
深圳美迅嘉润影业投资有限公司,3.3207318769920966,4
李冰冰工作室,3.3207713033193094,4
任泉工作室,3.3207713033193094,4
院线通,3.3207713033193094,4
北京德信投资管理公司,3.325199473855778,4
北京稻草熊影视文化有限公司,3.3255279777768925,4
北京家乐创新影视文化传媒有限公司,3.3301925109269783,4
中国电影家协会,3.331692449021478,4
深圳市世纪领军影业投资有限公司,3.3317531481935023,4
北京天际征鸿影业投资有限公司,3.3317531481935023,4
深圳泛亚中视文化传媒有限公司,3.3317531481935023,4
