医药卫生报社,-0.1549019599857432,0
河南省龙邦映像文化有限公司,-0.1549019599857432,0
河南省龙邦映像影视文化传播有限公司,-0.1549019599857432,0
北京虹合品尚文化传媒有限公司,-0.09151498112135022,0
北京幻影华亿传媒有限公司,-0.09151498112135022,0
山西华影众艺文化传媒有限公司,-0.09151498112135022,0
北京艺林天下文化传播有限公司,-0.09151498112135022,0
宁波莱彼特文化传媒有限公司,-0.09151498112135022,0
北京玲珑青文化传播有限公司,-0.06048074738138147,0
大连东方瑞迪文化传媒有限公司,-0.040958607678906384,0
大连瑞盈游艇制造有限公司,-0.040958607678906384,0
深圳视线文化传媒有限公司,-0.040958607678906384,0
北京国林卫士文化传媒有限公司,0.004321373782642578,0
东莞市倚天文化传播有限公司,0.004321373782642578,0
安徽博雅科贸有限公司,0.04532297878665747,0
贵阳艾美华星文化传媒有限责任公司,0.04532297878665747,0
张猛工作室,0.04532297878665747,0
西安阿房宫影视制作有限公司,0.08278537031645007,0
山西宇欢文化传媒有限公司,0.08278537031645007,0
浙江省永康市国爱文化传媒有限公司,0.08278537031645007,0
山西广电影视艺术传媒有限公司,0.08278537031645007,0
山西黄河影视社,0.08278537031645007,0
上海美感文化传媒有限公司,0.08278537031645007,0
太原天域文化传播有限公司,0.08278537031645007,0
重庆千姿广告文化传媒有限公司,0.11727129565576426,0
重庆百态广告文化传媒有限公司,0.11727129565576426,0
北京夺目世纪文化传播有限公司,0.11727129565576426,0
浙江省磐安县碧海青天影视传媒有限公司,0.11727129565576426,0
浙江红点影视制作有限公司,0.11727129565576426,0
东阳网传天下文化传媒有限公司,0.11727129565576426,0
常州大卫兄弟影视有限公司,0.11727129565576426,0
美国梦幻工业数码动漫公司,0.11727129565576426,0
北京帮柏美亚洲文化发展中心有限公司,0.14921911265537988,0
成都泰丰影业有限公司,0.16435285578443706,0
北京鼎龙盛世文化传媒有限公司,0.17897694729316943,0
中国新闻社湖北分社,0.20682587603184974,0
叮咚长响（北京）文化传媒有限公司,0.23299611039215382,0
中视奥美（北京）文化传媒有限公司,0.23299611039215382,0
河南省银都影视制作有限公司,0.23299611039215382,0
CLOVER FILMS PTE. LTD ,0.2576785748691845,0
G & J CREATION PRIVATE LIMITED ,0.2576785748691845,0
四叶草电影有限公司,0.2576785748691845,0
雄厚创作室,0.2576785748691845,0
北京紫金星空文化传媒有限公司,0.2576785748691845,0
北京金亿乾坤电影发行有限公司,0.3242824552976926,0
甘肃艺方水土影视发展有限公司,0.3242824552976926,0
交互时代国际文化传媒（北京）有限公司,0.3242824552976926,0
北京电影学院动画学院,0.3242824552976926,0
宁波龙泰影视有限公司,0.34439227368511066,0
北京建元东堂文化传媒有限公司,0.34439227368511066,0
喜蓝(北京)文化传播有限公司,0.34439227368511066,0
丝舒幔（北京）国际家具用品有限公司,0.34439227368511066,0
北京名将影视文化传播有限公司,0.3820170425748683,0
山西作家影视艺术制作有限公司,0.3820170425748683,0
济南电视台,0.3996737214810381,0
济南海水科技有限公司,0.3996737214810381,0
浙江泰嘉影业股份有限公司,0.4166405073382809,0
杭州亚妮影业有限公司,0.4166405073382809,0
唯优印象（北京）文化传媒有限公司,0.4166405073382809,0
北京昆仑阳光影视文化传播有限公司,0.4166405073382809,0
北京翡翠格纳文化有限公司,0.42813479402878873,0
江西在线影视传播有限公司,0.4329692908744057,0
奉化广播电视中心,0.4329692908744057,0
奉化名扬文化传媒有限公司,0.4329692908744057,0
奉化市名扬文化传媒有限公司,0.4329692908744057,0
奉化市大堰镇人民政府,0.4329692908744057,0
浙江星满天文化创意有限公司,0.4329692908744057,0
成都星利盟视觉文化传播有限公司,0.4487063199050798,0
北京东方雅荷文化传播有限公司,0.4927603890268375,0
建德雨歌动漫制作有限公司,0.4927603890268375,0
时代电影动画工坊,0.4927603890268375,0
北京中泰世博文化传播有限责任公司,0.4927603890268375,0
广西省田林县政府,0.4927603890268375,0
河南独立文化传播有限公司,0.506505032404872,0
北京华影金孔雀文化传媒有限公司,0.506505032404872,0
杭州辉煌时代动画制作有限公司,0.506505032404872,0
北京华世金辉影视科技有限公司,0.506505032404872,0
北京一品映画影视文化有限公司,0.545307116465824,0
湖北中盟影视有限公司,0.545307116465824,0
武汉五洲恒顺创业投资管理有限公司,0.545307116465824,0
北京正君文化传媒有限公司,0.545307116465824,0
重庆踏雪寻梅影视策划工作室,0.557507201905658,0
中视傲然（北京）国际文化传媒有限公司,0.5693739096150459,0
秦皇健达影视制作有限公司,0.5693739096150459,0
香港沙龙电影有限公司,0.5809249756756192,0
刘氏国际影业有限公司,0.5809249756756192,0
北京白泽国际影业有限责任公司,0.5809249756756192,0
北京佳尚国际影视文化传媒有限公司,0.5809249756756192,0
重庆小熊座文化传播有限公司,0.5809249756756192,0
由甘肃大河传媒有限公司,0.5921767573958667,0
苏州广播电视总台,0.5921767573958667,0
苏州秀麦文化传播有限公司,0.5921767573958667,0
甘肃大河传媒有限公司,0.5921767573958667,0
北京燃情岁月文化公司,0.5921767573958667,0
祥意麒麟影业公司,0.5921767573958667,0
永康燃情岁月影视文化有限公司,0.5921767573958667,0
新疆华奥国际投资有限公司,0.5921767573958667,0
青岛东塘文化传播有限公司,0.5921767573958667,0
烽影文化传媒有限公司,0.6031443726201822,0
中创美视影视传媒有限公司,0.6031443726201822,0
中创美视影视传媒,0.6031443726201822,0
烽影文化传媒,0.6031443726201822,0
广州瀚潮影视传媒有限公司,0.6242820958356682,0
重庆昌和世纪影业有限公司,0.6242820958356682,0
广东搏牛文化传播有限公司,0.6541765418779605,0
石家庄精合双成文化传播有限公司,0.6541765418779605,0
北京老虎数字传媒有限公司,0.6683859166900001,0
星意（上海）文化传播有限公司,0.6730209071288961,0
福建玉川文化产业投资有限公司,0.6730209071288961,0
三亚赫迪文化发展有限公司,0.6730209071288961,0
北京嘉合映画影视文化传媒有限公司,0.6910814921229684,0
天雄圣视（北京）文化传媒有限公司,0.6910814921229684,0
镇江企联文化传媒有限公司,0.6910814921229684,0
华夏中影（北京）文化传媒有限公司,0.6910814921229684,0
华派影业（深圳）有限公司,0.6998377258672457,0
北京正义网络传媒有限公司,0.6998377258672457,0
北京雅越文化传播有限公司,0.6998377258672457,0
北京艺海星光国际文化发展有限公司,0.704150516839799,0
北京金润佳宏影视文化有限公司,0.704150516839799,0
西安一路阳光影视文化有限责任公司,0.7084209001347127,0
陕西太和实业集团有限公司,0.7084209001347127,0
尔塞纳影视文化（北京）有限公司,0.7084209001347127,0
西部科创实业有限公司,0.7084209001347127,0
北京龙视百纳文化传媒有限公司,0.7168377232995244,0
北京亚兿星空文化传媒有限公司,0.7168377232995244,0
江苏火火影视文化有限公司,0.7168377232995244,0
北京迷影时代文化发展有限公司,0.7168377232995244,0
李曼华导演工作室,0.7168377232995244,0
北京一江春水影视文化传播有限公司,0.7168377232995244,0
深圳银河星光国际影视文化传媒有限公司,0.7168377232995244,0
东北亚(肇东)文化创意有限公司,0.725094521081469,0
莫斯科亚历山大利特维诺夫影视制片公司,0.725094521081469,0
东方金鹏（北京）文化传媒有限公司,0.725094521081469,0
肇岳山(肇东)影视文化传媒有限公司,0.725094521081469,0
辽宁省新闻出版广电局,0.7331972651065694,0
中共沈阳市委宣传部,0.7331972651065694,0
沈阳市文化广电新闻出版局,0.7331972651065694,0
中国文学艺术基金会,0.7331972651065694,0
中国爱乐乐团,0.7489628612561613,0
北京派华文化发展有限公司,0.7641761323903306,0
福建红人汇文化传播有限公司,0.7715874808812553,0
陕西美图文化传播有限公司,0.7930916001765801,0
河北波仔文化传播有限公司,0.8000293592441342,0
河北顺直通文化传媒有限公司,0.8000293592441342,0
西安电影制片厂,0.8088858673598119,0
北京天脉兄弟影视艺术有限公司,0.82020145948564,0
恩施华硒影视文化传媒有限公司,0.82020145948564,0
湖北省恩施州广播电影电视局,0.82020145948564,0
湖北省宣恩县旅游局,0.82020145948564,0
南天艺合(北京)文化传播有限公司,0.8394780473741984,0
湖南省文学艺术界联合会,0.8457180179666586,0
深圳华玺文化传媒有限公司,0.8639173769578604,0
南通泰东文化传媒有限公司,0.8756399370041683,0
中共深圳市委宣传部,0.8756399370041683,0
深圳市文学艺术届联合会,0.8756399370041683,0
深圳市对口支援新疆工作前方指挥部,0.8756399370041683,0
中共塔什库尔干塔吉克自治县委员会,0.8756399370041683,0
塔什库尔干塔吉克自治县人民政府区委宣传部,0.8756399370041683,0
深圳前海秦东文化传媒有限公司,0.8756399370041683,0
北京恒元影视文化传媒有限公司,0.887054378050957,0
中网宣（北京）文化传媒有限公司,0.887054378050957,0
聊城市委宣传部,0.887054378050957,0
中国行为法学会廉政行为研究会,0.887054378050957,0
重庆蓝海世纪影业有限公司,0.8926510338773003,0
北京星辰合力影视文化传媒有限公司,0.8926510338773003,0
中国人口宣教中心,0.8926510338773003,0
北京星辰合力影业有限公司,0.8926510338773003,0
北京云之国传媒有限公司,0.8926510338773003,0
北京华影卫士影视艺术交流中心,0.8926510338773003,0
北京艺海莲舟影视文化艺术交流中心,0.8926510338773003,0
星云时代（北京）影视文化传播有限公司,0.8926510338773003,0
兰州浩发影视传媒有限公司,0.9063350418050906,0
中国人民解放军第三〇二医院,0.9196010237841109,0
北京夏云飞国际影视文化有限公司,0.9390197764486664,0
意汇传媒,0.940018155007663,0
北京申开影视文化有限公司,0.9449759084120478,0
兰州电影制片厂,0.9449759084120478,0
天润文化产业有限公司,0.9449759084120478,0
北京库客东方文化传播有限公司,0.9498777040368748,0
北京东方明星影业有限公司,0.9498777040368748,0
成都赛为文化顾问有限公司,0.9547247909790628,0
成都唯爱婚庆服务有限公司,0.9547247909790628,0
北京金尊天悦文化传播有限公司,0.9642596301968488,0
青岛金亿丰投资集团有限公司,0.9642596301968488,0
北京中广蚨岛文化传媒有限公司,0.9642596301968488,0
北京文交联合投资有限公司,0.9642596301968488,0
北京飞天唐自头影视文化发展有限公司,0.9642596301968488,0
杭州今古时代电影制作有限公司,0.9642596301968488,0
福建太阳山影视文化发展有限公司,0.9642596301968488,0
福建时代高峰影业有限公司,0.9642596301968488,0
宁波市司法局,0.9642596301968488,0
红色凯歌（北京）文化传媒有限公司,0.9735896234272569,0
浙江博瑞影视制作有限公司,0.9827233876685453,0
河南枫岭影视传媒有限公司,0.9827233876685453,0
浙江东阳言鼎影视传媒有限公司,0.9827233876685453,0
秦州数字领海电影科技有限公司,0.9827233876685453,0
江苏龙文振图动画制作有限公司,0.9827233876685453,0
河南泽亿房地产开发公司,0.9916690073799483,0
苏州金浩文化传播有限公司,0.9916690073799483,0
形创幻维（北京）文化传播有限公司,0.9960736544852752,0
北京第新影力文化传播有限公司,0.9960736544852752,0
北京中视国润文化传媒有限公司,0.9960736544852752,0
宁波第新影力文化传播有限公司,0.9960736544852752,0
开封群星闪耀文化传媒有限公司,0.9960736544852752,0
上海斐盛耐影业有限公司,1.0004340774793186,0
江苏沙钢集团有限公司,1.0004340774793186,0
深圳马语者文化传播有限公司,1.004751155591001,0
深圳市公安局消防监督管理局,1.004751155591001,0
浙江宏泰影视文化传播有限公司,1.004751155591001,0
北京麦丽斯影视文化有限责任公司,1.0068937079479003,0
北京时空传奇文化艺术有限公司,1.00902574208691,0
北京韵艺辉煌文化传媒有限公司,1.0132586652835165,0
肇庆天艺文化传媒有限公司,1.0216027160282422,0
东莞市海尚文化传播有限公司,1.0216027160282422,0
东莞东润文化传媒有限公司,1.0216027160282422,0
烟台东方电影有限公司,1.0257153839013404,0
金桥集团,1.0257153839013404,0
北京中视远图影视传媒有限公司,1.0338256939533101,0
北京浩然之气影视文化传媒有限公司,1.0338256939533101,0
坤艮聚和（北京）文化传媒有限公司,1.0338256939533101,0
北京光合作物文化传媒有限公司,1.0382226383687183,0
北京文睿众合文化传媒有限公司,1.0417873189717517,0
爱微笑文化传媒（北京）有限公司,1.049605612594973,0
北京和颂投资有限公司,1.049605612594973,0
淄博青禾文化传播有限公司,1.0633333589517493,0
北京星宇华夏国际影视文化传媒有限公司,1.0648322197385738,0
北京九天互动文化发展有限公司,1.0648322197385738,0
上海仁惠文化传播有限公司,1.068556895072363,0
华美星光文化艺术（北京）有限公司,1.068556895072363,0
北京伊德文化发展有限公司,1.068556895072363,0
奉化市广播电视中心,1.0759117614827773,0
云南省曲靖市百灵影视有限公司,1.0870712059065353,0
中国电影艺术研究中心,1.0972573096934197,0
上海艺都文化传播有限公司,1.1007150865730815,0
北京中视寰影文化传媒中心,1.1007150865730815,0
昆山长凡波影视文化有限公司,1.1007150865730815,0
江苏冠信影视传媒有限公司,1.1007150865730815,0
英瑞佳和（北京）影视文化传媒有限公司,1.1041455505540079,0
鄢陵英瑞佳和影视传媒有限公司,1.1041455505540079,0
东阳英瑞佳和影视传媒有限公司,1.1041455505540079,0
上海合衷文化传播有限公司,1.1075491297446862,0
福建省皇品文化传播股份有限公司,1.1215598441875008,0
领show天地文创产业园,1.1215598441875008,0
福建省泉州市兴世纪旅游文化有限公司,1.1215598441875008,0
北京复兴影业文化有限公司,1.1215598441875008,0
深圳铁色高原文化传播有限公司,1.1370374547895126,0
青岛德馨影视传媒有限公司,1.140193678578631,0
成都明羽文化传播有限公司,1.140193678578631,0
北京徕玛风尚文化传媒有限公司,1.1495270137543476,0
北京奇百奇文化传媒有限公司,1.1556396337597763,0
莉凡姐妹影视文化传媒有限公司,1.1556396337597763,0
河北中联影业院线有限责任公司,1.1556396337597763,0
北京真心英雄国际影视文化传播有限公司,1.1556396337597763,0
邯郸市峰峰矿区瑞鑫伟业物资有限责任公司,1.1556396337597763,0
高志森制作有限公司,1.1586639808139894,0
江西省铅山县人民政府,1.1616674124377357,0
北京飞天魅影文化传播有限公司,1.1616674124377357,0
北京猎海影视有限公司,1.1649473726218416,0
杭州明朗影视制作有限公司,1.1763806922432702,0
理想微微文化发展（北京）有限公司,1.1961761850399732,0
大连世润影视制作传播有限公司,1.1961761850399732,0
河南正和独立影视文化传播有限公司,1.2043913319192998,0
北京电影制片厂,1.2177470732627935,0
中视远方（北京）文化传媒有限公司,1.2229764498933913,0
盛世花火（北京）国际传媒有限公司,1.2276296495710086,0
上海文烟影视文化工作室,1.2307043136125688,0
保靖百泰黄金茶有限责任公司,1.2307043136125688,0
北京御翠珠宝有限公司,1.2307043136125688,0
龙山惹巴拉影业有限公司,1.2307043136125688,0
香港星藝有限公司,1.2332500095411003,0
香港mm2影视娱乐制作有限公司,1.2332500095411003,0
陕西希望在线文化传播有限公司,1.240798771117331,0
西安中环影视文化有限公司,1.240798771117331,0
中国电影资料馆,1.2457593559672768,0
北京半人马影视文化有限公司,1.250175948083925,0
北京芒格投资管理有限公司,1.250175948083925,0
北京天子安投资管理有限公司,1.250175948083925,0
小马时代（北京）文化传媒有限公司,1.2579184503140584,0
淮安市淮阴区人民政府,1.2579184503140584,0
江苏华娱动力传媒科技有限公司,1.2579184503140584,0
重庆金佛山文化传媒有限公司,1.2626883443016965,0
全国中小学电影教育供片中心,1.2626883443016965,0
祖恩影视文化传媒（北京）有限公司,1.2674064187529042,0
威海金马影视城有限公司,1.2743887955503788,0
洛阳影视传媒集团,1.2776092143040911,0
河南国杰文化传播有限公司,1.2776092143040911,0
新颜绽放文化传播有限公司,1.2812606870550127,0
湖南建锋工程有限公司,1.2812606870550127,0
北京动音乐扬文化传播有限公司,1.2812606870550127,0
昆明沧龙文化传播有限公司,1.290257269394518,0
恒亚文化传媒（大连）有限公司,1.290257269394518,0
重庆保利万和院线,1.290257269394518,0
中国台湾和田电影有限公司,1.290257269394518,0
重庆南川刘凌电影工作室,1.290257269394518,0
北京云上太阳影视文化有限公司,1.3025473724874854,0
北京仁和博纳文化传媒有限公司,1.3034120705967418,0
贵州省春晖行动发展中心,1.3077099234048069,0
广州秀天下文化传播有限公司,1.3077099234048069,0
南宁暄宜广告文化传播有限公司,1.3077099234048069,0
北京中博巨石文化传媒有限公司,1.3077099234048069,0
共青团贵州省委,1.3077099234048069,0
共青团黔东南州委,1.3077099234048069,0
中共锦屏县委,1.3077099234048069,0
贵州银幕文化传媒,1.3077099234048069,0
贵州三影多彩文化传媒有限公司,1.3077099234048069,0
山东沃尔德影视传媒有限公司,1.3161800988934524,0
北京光景世界影视文化有限公司,1.3244882333076562,0
景德镇智博影业文化有限公司,1.326540668516562,0
深圳悠悠岁月文化发展有限公司,1.326540668516562,0
广州飞娱传媒广告有限公司,1.3463529744506386,0
北京湍泷天吼文化传媒有限公司,1.3484995702838376,0
北京东方岚乐文化发展有限公司,1.3484995702838376,0
北京风山影业有限公司,1.3484995702838376,0
上海牵荣文化传播有限公司,1.3484995702838376,0
北京国映盛世文化传媒有限公司,1.3619166186686433,0
四川绵阳浩领投资有限公司,1.3619166186686433,0
四川剑南春集团,1.3619166186686433,0
北京慧华东方文化投资有限公司,1.3639878297484913,0
中国台湾禾田四季传媒股份有限公司,1.373095987078727,0
福建大唐盛世文化传媒有限公司,1.373095987078727,0
北京京粤世纪文化传媒有限公司,1.3785795761157746,0
北京汇铭鸿嘉影视文化发展有限公司,1.3785795761157746,0
北京韩露影视科技文化有限公司,1.3803921600570273,0
剑河县仰阿莎旅游投资开发有限责任公司,1.394626764272209,0
中共剑河县委,1.394626764272209,0
剑河县人民政府,1.394626764272209,0
贵州剑河县清水江畔房地产开发有限责任公司,1.394626764272209,0
贵州红遍天古典家具有限责任公司,1.394626764272209,0
重庆夏坤建设（集团）有限公司,1.394626764272209,0
贵州剑河园方林业投资开发有限公司,1.394626764272209,0
贵州凯里金泰房地产开发有限责任公司,1.394626764272209,0
黔东南州旅游局,1.394626764272209,0
北京上元中太国际文化发展有限公司,1.3981136917305026,0
北京龙尚国际文化传播有限公司,1.3981136917305026,0
美纳影视有限公司,1.400537989391946,0
寻梦文化传媒（北京）有限公司,1.4051755462179893,0
珠海市星座文化传播有限公司,1.4067104586097898,0
东莞多影多视文化传播有限公司,1.4067104586097898,0
友邦兄弟（北京）影视文化传播有限公司,1.4067104586097898,0
俞才斌影视工作室,1.4067104586097898,0
呼伦贝尔金马文化创意产业（影视）有限公司,1.4117880045438687,0
商丘市天元文化传播有限公司,1.4134674129858247,0
上海星格影业有限公司,1.4151403521958725,0
上海兴美文化传播有限公司,1.4151403521958725,0
夏纳文化传播有限公司,1.4151403521958725,0
上海晨杰文化传媒有限公司,1.4151403521958725,0
上海魔洲影业有限公司,1.4151403521958725,0
上海出版印刷高等专科学校,1.4151403521958725,0
上海盛美影视文化传媒有限公司,1.4151403521958725,0
北京中视宇珩文化投资公司,1.4184670209466004,0
山东三圣影视公司,1.4184670209466004,0
济南一叶菩提文化发展有限公司,1.4217684012069238,0
济南盛景文化传媒有限公司,1.4217684012069238,0
黔南报业文化传媒有限责任公司,1.4250448745513886,0
三都水自治县人民政府,1.4250448745513886,0
如鱼得水电影有限公司,1.4331295175804855,0
云南电影集团有限责任公司,1.4331295175804855,0
河南杨氏文化传媒有限公司,1.4347285417797575,0
北京彭丹世纪影视文化有限公司,1.4364806950094948,0
中共庆元县委,1.445759836488631,0
庆元县人民政府,1.445759836488631,0
黑龙江乐彤文化传媒有限公司,1.4488608456074406,0
北京齐鲁兄弟影视制作有限公司,1.4488608456074406,0
武汉农商行传媒,1.4504030861553663,0
中影集团电影数字制作基地有限公司,1.4504030861553663,0
四川正光房地产开发有限公司,1.4505570094183289,0
北京格里芬影视文化传媒有限公司,1.4595432582804129,0
兴化市创星文化艺术传媒有限公司,1.4610480916706579,0
大太阳（北京）影视制作有限公司,1.4610480916706579,0
秦州市凤城河风景区管委会,1.4610480916706579,0
江苏天宝置业有限公司,1.4610480916706579,0
秦州嘉捷置业有限公司,1.4610480916706579,0
秦州海林置业有限公司,1.4610480916706579,0
济南军区政治部电视艺术中心,1.4610480916706579,0
凤凰东方华娱（北京）国际文化传媒有限公司,1.4640422054388107,0
北京万龙飞腾影视文化传媒有限公司,1.4714384073892992,0
北京火星空间文化发展有限公司,1.4714384073892992,0
北京两两嘉品商贸责任有限公司,1.4714384073892992,0
云南云政珠宝有限公司,1.4714384073892992,0
云南金翅鸟文化传播有限公司,1.4714384073892992,0
深圳市奥琪文体策划有限公司北京分公司,1.4729026518036639,0
重庆市久来文化传媒有限公司,1.4787107555127592,0
海霖动画制作有限公司,1.4787107555127592,0
东莞创意文化传播有限公司,1.4787107555127592,0
东莞海霖动画制作有限公司,1.4787107555127592,0
中共宁波市海曙区宣传部,1.4787107555127592,0
北京汗腾格里影视文化交流有限公司,1.4801507252732802,0
烟台清泉影视文化有限公司,1.4858633295973345,0
北京精点蓝数码电脑设计制作有限公司,1.4858633295973345,0
中共唐山市委宣传部,1.490099005063305,0
大泓画面国际影视文化传媒（北京）有限公司,1.490099005063305,0
北京宇际星海广告有限公司,1.490099005063305,0
北京艺德环球文化艺术有限公司,1.490099005063305,0
上海裕隆文化传媒有限公司,1.490099005063305,0
中盟盛世（北京）国际电影有限公司,1.490099005063305,0
北京三鸿门文化传播有限公司,1.4929000111087032,0
北京三鸿门文化有限公司,1.4929000111087032,0
山西创艺影视制片责任公司,1.4956830676169153,0
六合华纳（北京）文化传媒有限公司,1.4970679363985047,0
江西尚世星河影视传媒有限公司,1.4970679363985047,0
鑫奕祥龙国际文化传媒（北京）有限公司,1.4970679363985047,0
宁波市暴风动漫有限公司,1.4970679363985047,0
武汉光亚文化艺术发展有限公司,1.4984484031739995,0
湖北视纪印象科技股份有限公司,1.4984484031739995,0
北京燕昌荣新技术有限公司,1.4984484031739995,0
景德镇红都影业文化有限公司,1.4984484031739995,0
开化千和影视文化有限公司,1.4984484031739995,0
深圳旺发投资发展有限公司,1.4984484031739995,0
天盛润铎影视制作（北京）有限公司,1.5025636691073634,0
辽宁天悦影视传媒有限公司,1.5025636691073634,0
中航工业集团公司,1.5025636691073634,0
中共威海市宣传部,1.5025636691073634,0
楚伦文化传媒（上海）有限公司,1.5052856741441323,0
北京真之影文化发展有限公司,1.5079907248196913,0
北京岐波盛世文化传媒有限公司,1.5079907248196913,0
苏州抹天印画文化发展有限公司,1.5079907248196913,0
广州澳视文化传播有限公司,1.509336958017644,0
广州兵艺文化活动策划有限公司,1.509336958017644,0
北京春迪梦源影视文化有限公司,1.5120169694961265,0
百思诚文化传媒（北京）有限公司,1.5199591807520683,0
北京艺杰映画文化传媒有限公司,1.5199591807520683,0
重庆银美影业传媒有限公司,1.5199591807520683,0
辉煌连线（北京）国际文化传媒有限公司,1.5199591807520683,0
重庆美电传媒有限公司,1.5199591807520683,0
北京嘉瀚影视文化传播有限公司,1.5199591807520683,0
北京时越网络科技有限公司,1.5212688755983852,0
北京艺亨东方教育科技有限责任公司,1.5212688755983852,0
北京世纪华文文化传播有限公司,1.5251744278352715,0
山东传奇文化产业有限公司,1.5251744278352715,0
滨州传奇文化产业有限公司,1.5251744278352715,0
四川通达艺鑫影视文化传播有限公司,1.5290451707657686,0
上海福煦影视文化投资有限公司,1.530327789778086,0
